Tweet,Date
"It appears a large air raid against Ukraine is ongoing. Reports of explosions in Kyiv, Sumy, Kharkiv, Poltava and Mykolaiv.",2022-12-29
"Friends, we're ok
Air raid lasts already 5 hours in the whole Ukraine
Ukraine is under massive attack of drones and missiles
I just heard explosion, I want to hope this is our air defense",2023-03-09
"Air raid siren  in Kyiv 
The group of iranian drones is directing Kyiv region and Kyiv
We hope our air defense will shoot them down in time",2023-02-26
"Air raid siren  in Kyiv 
There're several groups of iranian drones which approach Kyiv region
Some of them are destroyed in neighbour regions
",2023-02-10
"Friends, we're ok
Right now we've air raid alert because of takeoff of russian aircraft MIG
Lately they refuel their stupid aircrafts in the air so the air raid alert lasts more than 3hrs
People can't use municipal transport in Kyiv
Have a nice Wednesday everyone
",2023-11-15
"Not really a bombing, the term ""air strike"" has given people the idea that we just dropped some bombs and left. Not so. Actually our air forces spent over an hour circling the hospital with repeated missile strikes and gunning down people trying to flee the burning building.",2022-08-14
"I ordered a new batch of medications for my parents and was about to go to the pharmacy for my order
Air raid alert again
Yesterday we had 5 alerts
It means thousands of people must leave municipal transport and wait till the end of alert
That's the reason why I work remotely",2023-03-15
"PAF literally announced an air raid & carried it out during day time. You being the defender, ended up losing multiple fixed and rotary wing aircraft that day. If that wasn’t enough, all PAF aircraft made it out safely. All of them were much older than the aircraft that IAF used.",2023-02-26
The air raid alert has been extended to all western regions. Multiple cruise missiles in the air. Go inside!,2023-06-08
"Three days of constant air raid exhaustion will probably be very noticeable tonight if there is a missile strike. I doubt it will be as large but who knows. 

Tu-95s are airborne, heading to launch positions.",2024-01-02
"Friends, the air raid is announced in Kyiv region because of the danger of iranian drones
There's a hope that all drones will be destroyed before they appear in the airspace of Kyiv",2023-07-03
"CNN says they haven’t heard an air siren for days in Ukraine, until Joe Biden showed up.

Russia had agreed to a ceasefire while Joe was in Kyiv.

That air raid siren sounding was nothing but propaganda for Joe’s “tough guy” campaign.

It didn’t work.",2023-02-21
"Sitting alone in a wartime city in the night, sipping iced whiskey, listening to the sound of air raid sirens roar, looking into the dark of the street. 
I will never forgive them for what they did to the Kyiv we love.",2022-02-28
I feared McLaurin might take a step without secondary weapon help but I was wrong.,2024-10-17
"Good morning from Ukraine 
Air raid sirens failed to wake me up again 
We’re still standing — thanks to our outstanding military and your support.
The mission is to keep standing until Russian beast machine breaks down.",2022-03-01
"The President of the United States flies overseas, takes a 10 hour train trip, walks through the city while air raid sirens go off.  

Meanwhile, Putin cowers on an armored train, scared of everyone in the world including his own people.",2023-02-20
"It's quite an interesting progress from ""Russian soldiers already booking restaurant tables in Kyiv"" in February to ""Russian occupational authorities urgently checking air raid shelters in Sevastopol"" in August, don't you guys think?",2022-08-22
ピンデル君て日本ではAir raidの方が良いんとちゃう？？,2024-10-16
"Air raid sirens, rocket launches... 
Catch 360 degree coverage on war only on India Today. 

#Lebanon #Israel #War #Promo | @gauravcsawant",2024-10-15
Half the teams in the Top 10 lost FWIW …,2024-10-17
"According to reports, an air raid siren went off next to the Engels airfield.

The night is young.",2022-12-26
Air Raids are currently taking place over Kharkiv,2022-02-26
Air raids throughout the whole country. Drones heading for Ukraine as well a possible threat of cruise missiles. That keeps me awake..,2023-03-09
"An air raid alert has been declared throughout Ukraine

Sirens sound also in Kiev and the region. 

The cheap show must go on , Ursula is in town , cheap tricks as usual.",2023-11-04
"75 fixed wing heavy and medium bombers took part in initial attack. Targets focused on military air defenses, barracks, ammo warehouses, 10 airfields",2022-02-24
"I know most people dont want to hear this, but i think this was not a very sucessfull raid. The lack of secundary explosions suggest only 1 plane has been hit. Which is dissapointing if you sent 40 drones.",2024-04-05
Air Force just launched a wave of massive airstrikes in Gaza; shock waves of bombing felt all the way in Tel Aviv (via @GLZRadio),2023-10-09
The all clear just came. The air raids are typically very short which I guess means that it was just one or a few missiles fired against the city.,2022-04-12
The attack last night was conducted by three F-35 fighter jets @ArieFriedman,2024-04-19
" aviation working in unexpectedly large groups (4-5 pairs of aircraft), multiple sorties during daylight, some to the east coast of Dnipro river. There haven't been such large air-raids in this war. Either  doesn't have any working air-defense, or it's very limited.",2022-08-06
"I’d argue it was a blessing in disguise. Something clicked for Allen and he came back a different (yet, still developing) player. #BillsMafia",2024-10-17
"Air raid sirens are sounding in ""Nativ Ativ"" in northern Golan.  
#Israel #Lebanon",2024-10-17
"Air raid sirens are sounding in the Metula settlement and its surroundings in the Upper Galilee.  
#Israel #Lebanon",2024-10-17
They even turned the air raid siren on so Biden could get a Netflix shot  https://t.co/GWV8neX87F,2023-02-20
"L'armée israélienne a qualifié le raid aérien contre l'école de Jabalia de « frappe précise »
Israeli military says Jabalia school air raid a ‘precise strike’ https://aje.io/rc8nyq?update=3253446… via @AJEnglish",2024-10-17
"The Israeli army says air raid sirens were activated across central #Israel, including the commercial hub of Tel Aviv, as projectiles were fired across the border from Lebanon. 

       https://english.alarabiya.net/News/middle-east/2024/10/14/israel-army-says-sirens-sound-over-central-israel-as-projectiles-fired-from-lebanon-…",2024-10-14
"In a brazen display of contempt for rule of law, President Biden and son Hunter board Air Force One together the day after Biden's FBI engaged in a political raid of the home of President Trump.",2022-08-11
"Neuf personnes tuées dans un raid aérien israélien sur le camp de réfugiés de Maghazi à Gaza.

Nine people killed in Israeli air raid on Gaza’s Maghazi refugee camp: Report https://aje.io/rc8nyq?update=3253784… via @AJEnglish",2024-10-17
"The cold. The constant air raid warnings. Remembering friends & family lost to Russian terrorism. 

This is the reality for Ukrainians this Christmas. We can't forget or dripfeed support. We must be all in, for them. #StandWithUkraine",2023-12-24
"It’s about 75k people converging on a stadium in blizzard conditions and taking country resources for other areas that need it. 

Nothing to do with the actual game.",2024-01-13
