Tweet,Date
"PTI worker Sohail Khan was shot on the 9th of May while exercising his constitutional right to protest peacefully against the unconstitutional and unjust abduction of his party chairman, Imran Khan.

His leg had to be amputated but then in yet another case of blaming the victim,",2023-07-20
"Wahid Kambar is a war prisoner and Council of Europe anti torture Committee (CPT) should intervene in Wahid Kambar’s abduction case.He was abducted from Iran, and his family has doubts that Pakistan is involved in this abduction
Iran and Pakistan are accountable for his abduction",2024-09-21
"Elizabeth Shull, Dawn Abduction (c. 2020)",2024-08-25
High Court allows Law Society of Kenya (LSK) and Mombasa Law Society (MLS) to join the case concerning the abduction and gang rape of blogger Bruce John.,2024-10-02
"Trigger warning: This video contains images that are disturbing. Viewer discretion is advised.

WATCH: Rights group Karapatan shows the CCTV footage of the abduction of activist Felix Salaveria Jr. in Bicol. Salaveria, along with James Jazmines, was abducted in August.

Related",2024-09-24
"(LANDMARK PAPER) A Critique of Budd Hopkins' Case of the UFO Abduction of Linda Napolitano / Joseph J. Stefula, Richard D. Butler, George P. Hansen / 1993",2024-09-15
"Next up on my Alien Abduction filmography list is ‘The UFO Incident’, a 1975 television film based on the bestselling book ‘The Interrupted Journey’ written by John G. Fuller. It documented the Betty and Barney Hill alien abduction case, the first widely publicised UFO close",2024-10-07
» Netflix documentary to investigate 'greatest alien abduction case' | Unexplained Mysteries,2024-10-10
Come on just a bit farther and quit stalling.  The abduction of Joanna Jute,2022-03-05
Paperback back cover for my book ‘Barney & Betty Hill Abduction 1961’ on Amazon. It tells the story of the legendary abduction case that created the alien  kidnap phenomenon that subsequently followed. #WritingCommunity #amwriting #london #newhampshire,2024-10-15
"The next thriller to read on Kindle Unlimited. When agent Zoe looks into a child abduction case, she finds a nest of international criminals with evil plans afoot. Rating: 18+ Amazon http://amzn.to/3yd5SNl #Bookboost #Bookblast #Bookplugs",2024-09-23
"https://dailymail.co.uk/femail/article-13918107/netflix-documentary-mystery-alien-abduction-case.html…
Inside bizarre true story of 'greatest alien abduction case ever seen'",2024-10-04
"Q𝕏 Abduction Protocol
Case #: GM0907",2024-09-07
"#ufotwitter #Ufohistory
Today in UFO History - Aboard a Flying Saucer
October 4, 18, 1966 — 
Excerpts of John G. Fuller’s book about the Betty and Barney Hill abduction case, Interrupted Journey, appear in a two-part article of Look magazine. [Eberhart]",2024-10-04
"The Manhattan Alien Abduction | Official Trailer | Netflix

A woman claims to have been abducted from her bedroom in Manhattan. This docuseries explores whether it was an elaborate hoax or proof of alien life.

I'll leave a link to Budd Hopkins book about this case in the next",2024-09-25
"Gonda, UP
Kavita got married in 2017, she disappeared in 2021.
Kavita's parents registered a case against her husband and in laws of Abduction and Murder.
She was found alive in Lucknow with her lover.
Her lover was a shopkeeper in Gonda from where Kavita used to buy goods. Both",2024-10-07
"Police Links Governor Nassir to Blogger's Abduction and Gang Rape CaseMombasa Governor Abdulswamad Nassir has been implicated in a case involving the abduction and rape of a blogger, leading to the arrest of four suspects.
https://tukio.co.ke/2024/09/24/police-links-governor-nassir-to-bloggers-abduction-and-gang-rape-case/…",2024-09-24
"Netflix Explores One of History's Most Bizarre Alien Abduction Case
#aliens #ufo",2024-10-08
The next thriller to read on Kindle Unlimited. Read the shocking new case for agent Zoe. This child abduction case is personal. Rating: 18+ Amazon http://amzn.to/3yd5SNl #indieauthor #IndieBooksBlast #IndieBooksBeSeen,2024-09-23
"Convicted Deputy Inspector General Gilbert Masengeli in court after seven snubs, awaiting Justice Mugambi's directions on the Kitengela abduction case.",2024-09-20
"Proceedings in the abduction case of Wajir MCA Yusuf Hussein Ahmed to be held in camera as Justice Alexander Muteti of the High Court bars journalists and the public from attending, citing security concerns surrounding the case.",2024-10-08
"Hello @NitishKumar @yadavtejashwi what's happening in Bihar?

A Muslim girl was allegedly abducted, and the family alleges that they were threatened by the accused to withdraw the complaint.

Will @bihar_police take action??

#JusticeForGulfasa",2023-09-19
"A man Out on Bail in Abduction Case, the Man Kidnaps Same Girl Again, Rapes Her for a Month, #bhadoi",2024-09-10
"The case on the abduction of Yussuf Hussain Ahmed,takes a new twist.

High Court bars Journalists and public from court, citing security concern.

We just want this man alive. Just that.

#FreeYussufHussain #RutoMustGo",2024-10-07
" New head of Sri Lanka Ports Authority accused of shielding suspect in Tamil youth abduction case

Admiral Sirimevan Sarathchandra Ranasinghe, a former Commander of the Sri Lankan Navy, who has been accused of shielding a suspect involved in the abduction and murder of 11",2024-10-07
"#BreakingNews 

Kerala High Court dismissed the plea of the survivor in the 2017 actor abduction and sexual assault case seeking a probe by a special investigation team on the unauthorised access to the memory card while it was in court's custody

@NewIndianXpress @xpresskerala",2024-10-14
"If you reside in Odukpani LGA I'm CRS and have any issues of Child Protection 

Rape
Assault
Abuse
Abduction

Pastor Leonard Ekpenyong is the Child Protection Network Coordinator for that region...

If you hear of any case, reach out to him or myself to connect you with him.",2024-10-07
Betty and Barney Hill: The first recorded alien abduction case that shocked the world.,2024-10-03
"#ufotwitter #uaptwitter #ufox #uapx #ufohistory
On today's date 67 years ago...one of the first abduction cases in the record...The Vilas-Boas case.",2024-10-16
"In this video, a Hindu woman is abducted in daylight, out-side session courts Umarkot,Sindh-Pakistan, where always police presents. Woman screaming for help, they dragged her from hair & put her in car, people around her watch carelessly.
Courtesy:Shiva Kacchi ⁦⁦@USCIRF⁩",2022-08-27
"The UP police are threatening me after failing to file an FIR in a 16-year-old girl’s abduction case. Now, when I called them, instead of taking action, they are threatening me.

On the 24th September, a 16-year-old minor girl was abducted by a 22-year-old named Shivam Yadav. On",2024-09-30
"This incident is from May 2023, which you posted at least twice: once in July 2023 and again in November 2023, yet you are still sharing the same incident.

Oishi Saha actually eloped with her bf. Since she was a minor, an abduction case was filed. And she was found-rescued on",2024-09-17
" Ireland - 17th June 2024

A foreign national has been remanded in custody over an alleged child abduction in Monaghan

Giedrius Gasiunas (44), exited the vehicle & grabbed the child by the shoulder 

It also emerged that the foreigner is breaching a Deportation Order",2024-06-17
"Proceedings in the abduction case of Wajir MCA Yusuf Hussein Ahmed to be held in camera as Justice Alexander Muteti of the High Court bars journalists and the public from attending, citing security concerns surrounding the case.",2024-10-07
"Abductions still happening 

Msee amebebwa Kiambu road",2024-08-06
"The court-ordered kidnappers tell the girl that their time with their mother is “only temporary custody” while the 15 year old explains that if she and her brother are taken “she will make it permanent”

These children have not been heard from since.",2023-04-04
"Sahil Kumar has been kidnapped from Kandhra, Sukkur five days ago — the police have failed to recover him.
Last year, a child Priya Kumar went missing from Kandhra, and still, no one knows whereabouts of her.",2023-03-24
"Hindu Girl (16) was kidnapped by Muhammad (31) from Fathimapuram, Chintalapudi(M), West Godavari Dist, Andhra Pradesh. Police found that she was taken to Hyderabad & then to Vikarabad.
See the response from Circle Inspector to her father.
@NCPCR_ @SpWestgodavari @hydcitypolice",2021-11-17
"Big Breaking News: Mohammad Aamir a tuition teacher abducted his 15-Year-Old minor hindu girl student in Bihar's begusarai, absconding !!

It's been 4 days filled a police report, but nothing is known yet. When the mother went to complain, accused's father misbehaved with her
+",2022-11-25
"Mumbai | A 16-year-old girl abducted in 2013 at the age of seven reunites with her family after 9 years; one held for kidnapping

She went missing after she left school to return home. During questioning, she told us that she was abducted by one Harry D'souza: M Kurde, Insp (6.8)",2022-08-06
POSSIBLE KIDNAPPING --- 50th St and Astor Pl SE DC. Man taking baby supposedly told toddler's mother that the baby's father owes him $$. Police are initiating a widespread search for the man and baby boy. #MarshallHeightsDC @HelicoptersofDC,2023-04-02
"A very good news from Kerala.

Abigail Sara Reji, who was abducted yesterday from Oyoor, has been found by Kerala Police.",2023-11-28
Yet again the @IG_NPS of police failed yesterday to bring to court my clients...two Indian Nationals and their Kenyan driver...60 days plus since their abduction by police officers...this case is the last documented police abduction during the tenure of Kinoti as CID Director.,2022-09-30
"A 1971 baby abduction case in Fort Worth ended with a tearful reunion 51 years later, after a DNA match.",2022-11-30
Honored that Othram could assist the Alma Police Department & Arkansas State Police in identifying the suspect in the 1995 abduction of six-year-old Morgan Nicks. #dnasolves,2024-10-01
"अनुज...जयपुर पुलिस

जयपुर से 18 अगस्त को अनुज का अपहरण हुआ। किडनैपर मुंह पर टेप, हाथ-पैर बांधकर ले गए। फैमिली से 20 लाख फिरौती मांगी। पुलिस ने पहले आरोपियों को दबोचा, फिर हिमाचल प्रदेश के होटल में पहुंचकर अनुज को रिकवर किया। मास्टरमाइंड वीरेंद्र सिंह, सॉफ्टवेयर इंजीनियर है।",2024-08-27
Shocking abduction in Mumbai caught on camera! Shinde camp MLA's son abducts music company CEO and 'made to sign documents on gunpoint'. #ITVideo | @PoojaShali,2023-08-10
"Mumbai's Dindoshi Police rescued a 43-year-old designer of booklets and catalogues who was allegedly abducted from Mumbai and taken to Surat by four men in a car. All 4 accused have been arrested. Case registered under sections 365, 323, 504, 506 and 34 of IPC: Mumbai Police",2022-11-05
New Netflix documentary set to unravel bizarre mystery of 'greatest alien abduction case ever seen' https://dailymail.co.uk/femail/article-13918107/netflix-documentary-mystery-alien-abduction-case.html… #UFO #UAP #Space #NASA #UFOS #UFOTWITTER #Aliens,2024-10-03
"SC Acquits 7 Men In 1985 Case Of Abduction, Murder Of Woman",2024-09-27
"How long must #SamsonKE ’s family wait for answers? His illegal abduction in Nairobi remains unsolved. @WilliamsRuto @AbiyAhmedAli @PMEthiopia @DCI_Kenya @InteriorKE, investigate this case! @citizentvkenya
#Justice4SamsonKE
#3YearsOfPainAndDarkness @SsElU9",2024-09-30
"Mohan Bhagwat Terms RG Kar Doctor Rape-Murder Case Shameful, Says ‘Abduction of Sita Led to Ramayana’ (Watch Video)

https://latestly.com/india/news/mohan-bhagwat-terms-rg-kar-doctor-rape-murder-case-shameful-says-abduction-of-sita-led-to-ramayana-watch-video-6336956.html…
#MohanBhagwat #RGKarDoctorRapeMurderCase #Ramayana
@DrMohanBhagwat @RSSorg",2024-10-12
So if it's David Langat vs Morara Kebaso that's a civil case. No need for abduction. He should have just been served by Langat's lawyers. That kind of harassment should not be happening now.,2024-10-01
" Guwahati Police Strike Back: 4 Arrested in Driver's Abduction Case
https://pratidintime.com/guwahati-news-breaking-latest/guwahati-police-strike-back-4-arrested-in-drivers-abduction-case…
Key Insights:

 Arrests: Four individuals apprehended in driver Amit Kumar Sinha's abduction case.

 Kidnapping Details: Amit was kidnapped on September 28 after picking up two",2024-10-09
"The Met police is facing new revelations over the death of Sarah Everard, with 7 officers accused of wrongly accessing case files about her abduction and murder.

5 officers are currently serving could be sacked if found guilty…",2024-09-27
Luis Armando Albino's 1951 abduction case has made headlines 70 years later for one reason: he was found.,2024-09-23
"JUDGMENT TODAY 

#SupremeCourt acquits 7 persons in a 39 year old abduction and murder case of a woman

Incident was of 1985.

A bench of Justice Bela Trivedi and Justice Satish Chandra Sharma pronounced the judgment.",2024-09-25
"Mombasa CEC granted Sh1 million anticipatory bond in abduction, gang rape case",2024-10-14
"UFO Case Review - Pascagoula Abduction, 1973:",2024-09-28
Sask. man who didn't want his daughter to get COVID-19 shots found guilty of abduction | CBC News,2024-04-20
"After Public Prosecutors in Palermo request 6 years' imprisonment for Matteo Salvini at his trial for abduction, lawyers for the NGO & the 147 migrants involved in the case ask for over €1m in damages (in Italy civil damages are included in the criminal trial).",2024-09-20
High Court orders proceedings in Wajir MCA Yusuf Hussein Ahmed’s abduction case to be held in camera; Justice Alexander Muteti bars journalists and public citing security concern,2024-10-07
"Fuck you people always supporting celebrities using police to abduct people in the name of arrest. See the way The Falanas are treating VDM’s case, that’s how it should be.

If you must use the police, get them to invite the person, not this gestapo style of abduction all the",2024-10-08
"Ask A Minister

EFF MP, Adv. Busisiwe Mkhwebane asked the Minister of Police, about the status of the investigation regarding the abduction case with case number 120/07/2016, opened at the Kimberley Police Station in the Northern Cape

Here is the Minister’s Answer.

If you",2024-10-13
"UP | Child kidnapping case in Greater Noida foiled within 24 hours 

An 11-year-old child had been missing since 12.30 pm on Oct 2. The father then received an extortion call, asking for Rs 30 lakh. Team started probe. Upon tip-off, accused were intercepted: DCP Abhishek Verma",2022-10-03
"Three Kenyans involved in a high-profile abduction case have been released, with rights groups alleging security forces held them for weeks following anti-government protests.",2024-09-20
"#BreakingNews: #AjitPrasad, son of #SamajwadiParty MP #AwadheshPrasad, has been charged with assault, issuing threats, and abduction. A case has been filed against him in Ayodhya

More details from News18’s Amit Singh

#UttarPradesh #Politics | @JamwalNews18",2024-09-22
"Three Kenyan protesters at the heart of a high-profile abduction case have been freed, with rights groups accusing security forces of keeping them captive for weeks.",2024-09-20
"How Amira’s ‘abduction’ drama started. On d ‘fateful’ day, she woke up early, prepared b/fast, showered & later told her mom she heard knocking on d door. The mom, who went about her household chores, barely noticed her absence until she shared her location to her contacts.",2022-06-17
"A 2018 case of abduction of a three-year-old boy by two women that was “solved” in less than 24 hours by #Chennai police fell flat before a city court last week after the victim’s mother turned hostile during the trial.
@Sidprabhakar7",2024-10-01
"The former dean of a Christian boarding school allegedly hired guys to abduct a teenager, handcuff him, and drive him 27 hours to... the Christian boarding school.

All with the boy's mother's permission.

Both adults face up to five years in prison.",2022-09-02
"Not for anything but if I’m in the woods with a dude & I get that vibe he’s getting stabbed & I’m getting out, that’s fucking weird & to be the most literal, honest he abducted her because he knowingly was misleading her & admits it. This was a crime yall.",2023-06-03
"A 10-month-old girl is found after her abduction from a New Mexico park, where police earlier discovered two dead and the infant's sister injured",2024-05-06
"PREMIUM: A hearing which permitted Visak Rajesh Leela to be named as the accused man in an alleged child abduction case heard lengthy legal argument about the public's right to information, writes FATIMA GUNNING",2024-09-18
"Authorities say a woman escaped abduction in New Jersey after a ""year-long nightmare"" across several states. The suspect is now charged with kidnapping.  https://cnn.it/3xyc5mb",2023-02-19
#DelhiHighCourt grants #bail to #accused in 2019 #abduction-#murder case,2024-10-16
Maharashtra | Pune District Court allows the Pune Police to take custody of the accused father in the driver abduction case connection to the car crash case,2024-05-27
He wasn't abducted. He was arrested for stabbing people.,2023-11-24
"Excellent work from ⁦@MiaCathell⁩ on the horrific Eliza Fletcher case.

Felon Charged in Murder of Kidnapped Teacher Was Released Early From Previous Abduction Conviction",2022-09-07
New Netflix documentary set to unravel bizarre mystery of 'greatest alien abduction case ever seen' https://trib.al/CvjTtpl,2024-10-03
"KANU PARTY announces alleged abduction of its Digital Communications Officer Cornelius Ronoh in Fedha, Embakasi East; asks police to arraign him in case he has committed crime.",2024-10-08
"Not officially, I announced his recovery as police told me that he is being released. There seems to be some issue with his release. We are trying to secure his release. Amjad is not the first case of abduction in Peshawar. Perhaps the first where ISI/MI and IB is not involved.",2024-10-08
The Family has asked the courts to compel the IG and DCI to produce MCA in court,2024-09-17
A man accused of taking his young daughter away so she wouldn’t get a COVID-19 vaccination has been found guilty of abducting her.,2024-04-19
Ransom and Abduction Case Busted in Vasco; Three Accused Arrested,2024-09-26
"Governor Nassir records statement over blogger abduction and assault case
https://kbc.co.ke/governor-nassir-records-statement-over-blogger-abduction-and-assault-case/…",2024-10-03
"Again I interrupt your lunch break to remind you that Bob Njagi ,Aslam and Jamil were abducted a month ago and we still don’t know there whereabouts .  #FreeBob
#FreeAslam #FreeJamil",2024-09-19
After 13 Years This Ohio Teen Unintentionally Solved His Own Abduction Case,2021-11-24
The High Court has allowed the Law Society of Kenya (LSK) and the Mombasa Law Society (MLS) to join the abduction and gang rape case of a blogger.,2024-10-02
"Police launch criminal investiagtion into alleged abduction of British teen Alex Batty, who was missing for six years",2023-12-22
"Delhi Police have arrested a kidnapper, identified as Mohd Ikbal, who abducted a ten-year-old girl in Nand Nagri on June 19. He is also found involved in two cases of alleged rape, say police.",2023-06-21
"Abigail Edan, the 4-year-old American dual citizen abducted by Hamas on October 7, has been released",2023-11-26
"We live in a lawless state ! Abduction of women is the lowest of all lows- today the CJ LHC during  a case said “ betyan tou sanjhi hoti hain” 

PTI wali ko kisi exception clause mein dala hua hai.",2024-10-16
"Nope - he actually abducted her. Blindfolded, tied up, stripped, thrown in a boot and left in the wilderness for nearly a week isn’t a fake abduction",2023-07-26
New Netflix doc to unravel 'greatest alien abduction case ever seen' #ufotwitter,2024-10-04
"BREAKING: Police are reportedly digging on the Moors for murder victim Keith Bennett, 12, after the skull of a child was found.

The schoolboy’s body has never been located after he was snatched by Ian Brady and Myra Hindley almost six decades ago.",2022-09-30
"This morning, Preet Pal Bagga in a complaint said that his son Tajinder Pal Bagga has been abducted from his house by some unknown persons.  A case under relevant sections 365/342/392/452/295A/34 IPC registered at PS-Janakpuri, Delhi: DCP West Ghanshyam Bansal",2022-05-06
"Oh, nothing to see here. Just supposed law professor and human rights activist @Heidi__Matthews, trying to make the case that rape, abduction of children and mass murder are legitimate forms of resistance!",2024-09-22
"Encuentran a menor de 13 años que había desaparecido , la encontraron en una habitación en un cité , la tenía un extranjero y será imputado por “sustracción de menor ” eso es rapto ya que una menor de edad y la llevo con engaños",2022-11-12
Kabatila Munyithya aka Kavat is still missing after being abducted on June 27th. https://x.com/CydWambui/stat/CydWambui/status/1808791740955980208…,2024-07-04
High Court orders proceedings in Wajir MCA Yusuf Hussein Ahmed’s abduction case to be held in camera; Justice Alexander Muteti bars journalists and public citing security concern.,2024-10-07
Police expect to charge a local man with abducting a 4-year-old girl from her family’s camping tent 18 days before police smashed into a locked house and rescued her in an outcome celebrated around Australia.,2021-11-04
"The child wasn’t abducted at all.

The mother traded her for sex to cover a $200 drug debt.",2024-03-01
"The kidnapping happened in 1989. The victim/witness was called to court today to give statement. She identified Yasin Malik.
But just look back,many govts came & went, the case languished. A kidnapping that had such grave consequences on national security",2022-07-15
A kidnapping case was filed at Andheri PS after she didn't return long after her school ended. Further investigation is underway: Waliv Police (2/2),2022-08-27
A 2018 case of abduction of a three-year-old boy by two women that was “solved” in less than 24 hours by Chennai police fell flat before a city court last week after the victim’s mother turned hostile during the trial.,2024-10-01
"This woman got kidnapped in Oregon over the weekend in the middle of the night, 20 April, 2024. thankfully, she's been located and rescued.",2024-04-23
"Police have solved the kidnapping case of a 4-year-old child. The child was abducted when he was travelling in an auto with his mother in the PS Delhi Cantt area yesterday. When the auto driver allegedly molested her mother, she ran away in order to save her life, later the",2023-06-27
#Kidnappings Some of the active cases: 11-year-old Mayfair girl. Mozambican national taken on the East Rand. 28-year-old Benoni Moulana. Businessman Saleem Tayob kidnapped: Durban. A Chinease national taken in Cape Town. A Pakistani national businessman  taken in JHB last night.,2021-11-18
"However, per contra no due complaince was observed by Punjab Police, the act of detaining and transporting the accused sans authority of law would amount to an offence of  Abduction. 2/3",2022-05-07
"Shahid Ansari, Arbaz Ansari & four others abducted the minor girl on November 4",2022-11-15
"Also, the law doesn’t care if you abduct someone for a minute, an hour, a day. An abduction is an abduction as soon as the elements are met and regardless of the time period that passes. So—saying it’s not a crime because someone temporarily abducted a baby & takes them to",2024-01-01
