Tweet,Date
"It’s really interesting Trump is doing a rally in Coachella California. 

There’s 20+ days until the election. 

Why would he do a California rally unless his internal polling was saying he could win California??  

This is such an interesting move. 

I hope I’m right.",2024-10-12
"So thousands of people were stranded after Coachella rally because Trump stiffed bus company. Why hasn’t MSM interviewed the people who got stuck there, or had to walk 2 hours to return to civilization?",2024-10-15
"Watch ""Live: Harris delivers remarks at Wisconsin campaign rally"" on YouTube",2024-10-17
"""Heartbreak is one thing, my ego's another ...""

Pennsylvania native Sabrina Carpenter is ready for a Phillies rally ",2024-10-09
"Good morning and Happy Friday to everyone who LOVES the joyful, normal, scandal-free way the Harris Walz campaign reaches people. Here's Tim Walz, ""at a political rally with our neighbors"" checking out the birds.

LOVE THIS! ",2024-09-20
"In a shock to absolutely no one, Donald Trump left his supporters stranded after his “rally” because he didn’t bother to pay the bus company.

Yes, he really is that cheap and selfish.",2024-10-14
"“Oh, you guys are at the wrong rally. I think you meant to go to the smaller one down the street.”

-VP @KamalaHarris ",2024-10-17
Gov. Walz arrives at packed Pennsylvania rally ,2024-10-02
"Trump’s rally ended with another performance of “Nessun Dorma”.

This song played in closing scenes of “Sum of All Fears”, where Russia and the US end nuclear tensions after the Deep State tried to assassinate the POTUS and start WW3.

Sound familiar?

Is Trump sending a message?",2024-10-06
BREAKING NEWS: Liberals placed a 43-foot naked statue of President Donald Trump near Kamala Harris Las Vegas rally. This is the left.,2024-09-30
"President Trump has a rally at Coachella in California on Saturday starting at 5 p.m. PST.

People are already forming a line.

Trump can win California!",2024-10-12
"Yikesssssssss!!!! Donald Trump was a slurry, incoherent mess at his Scranton, Pennsylvania rally. This may have been one of the most nonsensical speeches he’s ever made.

Let’s recap it:

He starts by overcompensating for his tiny crowd by saying there are “a lot of people here.”",2024-10-09
"Tell me you're not with the shyts without telling me! 
""Oh you guys are at the wrong rally! I think you meant to go to the smaller one down the street!""  #Vote    
#VoteHarrisWalz2024 #SaveOurDemocracy @VP @harris_wins @KamalaHarris @Tim_Walz @CNN @maddow @MSNBC ",2024-10-17
Trump’s Rambling Speeches Focus His Critics and Worry His Allies,2024-10-17
Donald Trump bused his followers miles into the desert for a rally and then left them there in the dark,2024-10-14
"WATCH: 

The crowds at President Trump’s return to Butler, Pennsylvania rally are massive. 

This is the line at 10 am. 

The event doesn’t start for another 7 hours. 

Donald Trump is an American hero.",2024-10-05
Trump still speaking halfway thru his rally while dozens of attendees are leaving already.  Why do you think?,2024-09-19
"The line to get into today’s @KamalaHarris rally in Ripon, Wisconsin

Local population: 7,772

#WIforHarrisWalz #CountryOverParty",2024-10-03
"One piece of my daily existence for at least the next 10 weeks will be reminding people that neither Donald Trump’s ear, nor any other part of his body was struck by an intact bullet at the Butler rally. 

No one from the Trump camp has been honest about what happened and we have",2024-08-29
" I asked this very nice woman and her daughter at the Trump rally in Uniondale, why she loves him and where she gets her news.  THEN she said she saw on the news “They’re stealing cats. They’re stealing ducks and dogs and they were eating them. They’re not going to lie,",2024-09-20
"OMG!!

Harris just promised at her Arizona rally that if she wins, she’ll secure the border.

But this has been her fvcking job since March 2021! Why isn’t she securing the border now?!!",2024-09-28
It turns out that the 'Scranton Firefighters for Trump' holding signs at Trump's rally–some even dressed up as law enforcement–were not firefighters at all. We dive into Trump's latest scam.,2024-10-11
"Vice President Harris: To the residents of this community, we are here for the long haul. In these moments of hardship, one of the beauties about who we are as a country is people rally together and show the best of who they are",2024-10-02
BREAKING REPORT: Legendary NFL Hall of Fame quarterback John Elway TO ATTEND Trump's Colorado rally..,2024-10-11
" BREAKING: ELON TO ATTEND TRUMP RALLY IN BUTLER

Elon will join Trump at his rally in Butler, PA, this Saturday. 

The event marks Trump's return to Butler Township, where he survived an assassination attempt in July.

Local officials and first responders are preparing for a",2024-10-04
BREAKING: Analysts are questioning Donald Trump’s stamina after his second rally today showed a steep drop off in performance. Trump was rambling incoherently and looked terrible.,2024-10-10
"Deplorable. You raise your flag on others land and they will rally and resist until you leave. 

Israeli soldiers raise their flag in Maroun Al Ras, Lebanon ",2024-10-08
"Dear @reformparty_uk @Nigel_Farage 

I’d like to speak at Reform’s South West Event on Sat 9 Nov

Or give members a ‘Batshit Bonkers Britain’ stand up show

No charge from me, a fundraiser for you

We are STRONGER TOGETHER.  (Pic at your last SW rally)",2024-10-17
"BREAKING 

Donald Trump will host a rally at Madison Square Garden to finish up his 2024 campaign 

Legendary.",2024-10-09
"Live from the @realDonaldTrump rally in Pennsylvania. 

Same location where he was shot. 

 https://x.com/i/broadcasts/1nAKEpDdkgyxL…",2024-10-05
Democrats showing up to a Kamala Harris rally,2024-09-29
"HOY SH*T 

This is a line of cars making their way to the Donald Trump rally in Coachella, California. But this isn’t Coachella, this is Moreno Valley, OVER AN HOUR AWAY!! This is going to be HUGE!",2024-10-12
.@KamalaHarris people leaving Trump rally early in Wildwood while he’s still talking. My video,2024-09-11
"Kamala Harris claps back at hecklers: ""I think you meant to go to the smaller (rally) down the street.""",2024-10-17
"GPS—Gaylord Rockies Resort & Convention Center Trump rally today, the total mobile devices when President Trump stepped on the stage, was 15,465, broken into two separate locations, the main exhibition hall with 10,354 mobile devices and what I’ve been told was an overflow area",2024-10-11
"LIVE: Trump Rally in Scranton, #Pennsylvania",2024-10-09
"It’s an ENDLESS sea of people here at Trump’s rally in Pennsylvania!

Holy CRAP! 

There’ll end up being 100K people here!!!",2024-10-05
"WATCH: 

@LoomerUnleashed just filmed this video of a drone that is currently flying over the Trump rally in Butler, Pennsylvania. 

I wonder whose drone it is.",2024-10-05
The Trump supporter deleted all his tweets about them getting stranded at the Coachella rally after the other Trump supporters attacked him for it making Trump look bad ,2024-10-13
Time for a Yankees rally,2024-10-17
"This Saturday in Reading, Pa., Congresswoman Chrissy Houlahan is having a GOTV Rally with Congresswoman Alexandria Ocasio-Cortez and Congresswoman Chrissy Houlahan, Reading H.S., 1pm-4pm
 - sign up now",2024-10-17
"NEW: Sen. Mark Kelly: Musk Supports Trump Because He Wants That ‘Giant Tax Cut’ for Billionaires

CNN’s Dana Bash set up Kelly to bash @elonmusk for his remarks at the rally in Butler, PA; leading with a question suggesting Musk has a conflict of interest with his companies’ govt",2024-10-06
"I watched the entire Trump rally in Oaks, Pennsylvania and broke it down minute by minute.  Trump awkwardly danced onstage for over 35 minutes for no discernible reason. There were two brief medical issues with members of the audience that appeared to resolve quickly.",2024-10-15
"The man arrested at Trump’s Coachella rally, Vem Miller of Las Vegas, expressed a desire to run for political office for 2A rights, anti COVID shutdown stuff etc. 

Also seems to be a Trump fan per Instagram posts.

He legally changed his name in 2020 and was involved in some",2024-10-13
"Elon Musk hopping around the stage at Donald Trump's Butler, Pennsylvania rally isn't helping the whole ""weird"" thing. 

So weird.",2024-10-05
"While speaking at a rally in Wisconsin, VP Harris responds to anti-abortion protesters who interrupted her. ""Oh, you guys are at the wrong rally. No, I think you meant to go to the smaller one down the street,"" Harris says.",2024-10-17
"Are you f@$king kidding me?

Toronto middle schools sent Grade 7 and 8 students on a “field trip” to take part in a political protest.

The protest was in fact an anti-Israel rally. One Jewish student was instructed to wear a blue shirt to identify her as a “colonizer.” After the",2024-09-21
"I spoke at a Republicans for Harris rally in Georgia last week, and let me tell you – the energy was electric! The message was clear: It takes courage to NOT vote for Trump... but it takes even MORE courage to vote against him, to vote FOR Kamala Harris.

We know what’s at stake,",2024-10-14
"Watch Live: Vice President Harris, President Obama, Governor Walz, Second Gentleman Emhoff, and more rally voters across America",2024-10-10
"Local rally event in 5 weeks, going and watching rally content all day ",2024-10-17
"MAN ARRESTED WITH GUNS, FAKE VIP PASS AT COACHELLA RALLY WAS PLANNING TO KILL TRUMP

A man carrying multiple guns and a fake VIP pass was arrested outside Trump's rally in Coachella, California.

Riverside County Sheriff Chad Bianco said the man, identified as 49-year-old Vem",2024-10-13
"Pink Out Pep Rally Recap! 
#TitanNation #Cen10Titans",2024-10-17
"Class of 2025             Class of 2037

This afternoon at @McAHighlander's 22nd Annual Community Pep Rally, kindergarten students exchanged gifts with @Marcus_HS seniors in a show of community support and unity!

#everyONE #OneLISD",2024-10-17
'The National Rifle Association on Thursday canceled a rally featuring Republican presidential candidate Donald Trump scheduled for Tuesday at the Savannah Convention Center.',2024-10-17
"Now, had these been hecklers at a Trump rally, he'd have instructed the crowd to beat the shit out of 'em.

Note the difference.",2024-10-17
"Calling all Lions x @BarrySanders fans, we're teaming up with Barry to give away two one-of-a-kind @NewEraCap autographed hats! Shop all Barry Sanders gear at Rally House online, and click the link to enter the giveaway today - https://brnw.ch/21wNSbV !
#BarrySanders #Giveaway",2024-10-17
" The Calm Before the Storm: Global markets, corporations, and regulations are waiting for a trigger. Many believe that the next crypto rally could be sparked by Trump's re-election and the shift toward more crypto-friendly regulations. Here’s what’s coming.  #Crypto #BTC",2024-10-17
" Kamala Harris: “Oh, you guys are at the wrong rally. I think you meant to go to the smaller one down the street.”",2024-10-17
"He literally went to a Trump Rally With Loaded Weapons
 Man arrested outside of Trump rally sues California sheriff over assassination accusations https://justthenews.com/government/courts-law/man-accused-plotting-third-trump-assassination-sues-california-law?utm_medium=social_media&utm_source=twitter_social_icon&utm_campaign=social_icons… via @JustTheNews",2024-10-17
"Kamala tells a heckler in Wisconsin, “You’re at the wrong rally! I think you want to be in the small one down the road!” ",2024-10-17
"Today’s rally was incredible and I will be forever grateful for the support, encouragement, and trust I receive from Utahns all across our great state. 

Utahns deserve much, much better than an illegitimate candidate for governor. @SpencerJCox @UtahGOP",2024-10-17
"Trump Attacks Jimmy Kimmel AGAIN, Elon Musk Joins Rally &",2024-10-17
"VP Harris claps back at hecklers 

 ""Oh, you guys are at the wrong rally. No, I think you meant to go to the smaller one down the street.”",2024-10-17
DEVELOPING: Tim Walz just arrived to his Pennsylvania rally like a WWE wrestler to combat the concerns about his debate against JD Vance last night.,2024-10-02
"Elon behind the scenes at the Trump rally telling the audience, ""Mars will make science fiction real. It doesn't have to be fiction for ever. It's the biggest space race in history. Awesome! The Star Fleet academy should be real!"" Make it so...",2024-10-06
"Trump was *pausing* his rally to allow for medical aid, you dizzy bint!  What was he supposed to do, stand there in silence?  The man has music in his soul and ain't afraid to show it! 
#TheFive",2024-10-17
"If you joined us for the SPACE CADETS FOR HARRIS zoom rally (and even if you didn't!), you can advertise your geek cred AND help elect Kamala Harris with SPACE CADETS FOR HARRIS merch, featuring the logo I designed for them! …https://spacecadets4harris.goodstockcompany.com",2024-10-17
Harris rally in LaCrosse WI. Mark Cuban at 15:50. #mapoli #nhpolitics #wiunion #wipolitics,2024-10-17
Kamala Harris just destroyed MAGA hecklers at her rally in the most impressive way possible,2024-10-17
"Ooooooh burn 

Ur at the wrong rally

U should be at the smaller rally down the road 

Kamala  to a protester ",2024-10-17
"“You are at the wrong rally, you need to be at the smaller one down the street” 

#KamalaHarris addressing a heckler and calling a medic for someone apparently passed out #rally #Wisconsin #TrumpvsHarris",2024-10-17
OMG.  Trump just shared this at rally in PA.  ,2024-10-09
"I love how Kamala Harris, without missing a beat, just told protesters at her rally that they were in the wrong place - that they must be looking for the SMALLER rally down the road.
What a class act she is…and sharp as a tack.",2024-10-17
"VP Harris to hecklers at her Wisconsin rally: “Oh, you guys are at the wrong rally. No, I think you meant to go to the smaller one down the street,",2024-10-17
"""You're at the wrong rally. You want the smaller one down the street.""

Best comeback line in years.",2024-10-17
"People lined the streets of Wisconsin to see President Trump today where his rally is at max capacity. 

WE WANT TRUMP!",2024-09-28
"I’m outside of Kamala Harris’s rally in Flint, Michigan right now and the crowd is HUGE! Michigan is FIRED UP for Kamala Harris!",2024-10-04
Kamala Harris shades Trump supporters at her rally,2024-10-17
"My mom @ConnieGMeyer is at the Kamala Harris rally in Green Bay. The very first thing I noticed in the pictures r white guys in camo hats and with gray hair. If that’s part of the big tent here in swingy/purple Green Bay, that is a very promising sign.  @Atticus59914029 @txsguy09",2024-10-17
"VP Harris telling a Trump supporting heckler in the crowd, “you’re at the wrong rally, it’s the smaller one down the street.”
BOOM!!!",2024-10-17
" This is my love language 

“Oh, you guys are at the wrong rally. I think you meant to go to the smaller one down the street.” - #KamalaHarris #Her #Vote",2024-10-17
"At a rally last week, former president Trump made a disturbing promise to deport millions of immigrants, citing the Alien Enemies Act of 1798 - the same legislation that provided the legal basis for the incarceration of Japanese Americans during WWII.",2024-10-17
"WATCH:

While speaking at a campaign rally, Tim Walz @Tim_Walz said “WE CAN’T HAVE 4 MORE YEARS OF THIS!”

His running mate is @KamalaHarris, the VICE PRESIDENT of the United States and she has been for the last 4 years.

Walz is right. We can’t take 4 more years of Kamala",2024-10-14
"To hecklers: 

""You guys are the wrong rally; you meant to go to the smaller one, down the street"" -- Kamala laughing! 

#Wisconsin rally for #HarrisWalz",2024-10-17
The Greatest Homecoming on Earth Pep Rally : Softball Edition,2024-10-17
"Looking forward to tonight, joining Ambassador @RichardGrenell @KimberlyGuilfoyle, @EricHovde Kash Patel @AlinaHabba, others on stage Thursday night for the Trump Unity Rally in Milwaukee. http://trumpunity2024.com/events/Milwauk… @wisgop @WIYRs @wicrs #wipolitics #MAGA",2024-10-17
"Damn.  She is SO SO SO good.  ""The smaller rally down the street"" - she knows how to trigger Trump and his rubes.",2024-10-17
"Ohhhh, Kamala just told a heckler…I think you’re at the wrong rally!!! I love her!!!",2024-10-17
"KAMALA GETS HECKLED during her rally in Wisconsin. She replies, “You guys are at the wrong rally. I think you meant to go to the smaller one down the street”. 
Bamm! Hahaha",2024-10-17
"It's so nice listening to Vice President Harris speaking during a rally. No slurring of words, complete sentences, and coherent thoughts.",2024-10-17
Kamala Harris just said to hecklers in LaCrosse “Oh you guys are at the wrong rally. Yours is the smaller one down the street. “ Slay!,2024-10-17
"Celebrated our Annual Harlan Heroes Homecoming Pep Rally today, thanks to all those that contributed to this special day. Thank you to our NISD Board Members, Mr. Salcido and Mrs. Saldana, for joining us today!!! @NISDHarlan",2024-10-17
.@KamalaHarris is explaining how #DemsWillDeliverHomeCare live at Wisconsin Rally,2024-10-17
"""You guys are at the wrong rally. I think you meant to go to the smaller one down the street.""-Kamala Harris. I missed it but I assume she was talking about pro-Trump protesters lol.",2024-10-17
“Oh you’re at the wrong rally.” Love Kamala Harris’ way of dealing with hecklers.,2024-10-17
Kamala is killing it at her rally..,2024-10-17
"Today, the #AllEyesOnYass coalition held a rally to #SayNoToYass money in the Lehigh Valley & across PA. Money talks, but together, we talk louder. We’re calling on candidates & electeds to put the people of PA over the donations of one billionaire’s attempts to buy elections.",2024-10-17
"Live: Dow closes at fresh record, Nasdaq ends higher as chipmakers rally @CNBC",2024-10-17
"Join #southfulton, #atlanta, #unioncity, #fairburn, #eastpoint, #collegepark, #hapeville, #chattahoocheehills, #palmetto, and beyond as we Rally for Kamala tonight from 6:00PM to 8:00PM!

Register here https://buff.ly/3YaEf3B",2024-10-17
"Bitcoin rally to $68.4K may have been the Uptober top — Here’s why

 Bitcoin’s price rejection at $68,500 and the record high use of leverage could be signs that BTC is in for a sharp correction. https://is.gd/SdxifI",2024-10-17
Lined up early for Trumps rally in CA!,2024-10-12
" President Trump just ROASTED a protestor who interrupted his rally in Coachella, California

“Go back home to mommy! …Her mother's a big fan of ours, you know that right?”

",2024-10-13
"Oh, snap, Kamala is speaking in La Crosse Wisconsin right now and someone heckled her. She told them that she thinks they’re at the wrong rally and that they probably want to be at the smaller one down the street. ",2024-10-17
"Trump’s canceled several events: 

60 Minutes
2nd Debate 
CNBC
NBC interview
NRA rally
CNN Townhall??? 

Looks like sundowning Grandpa lacks the stamina necessary to do campaign events. 
#DemsUnited #TrumpIsUnfitForOffice",2024-10-17
"Central European Rally wystartował dziś po południu w czeskiej Pradze.

Za Hubertem i Michałem dwa odcinki otwierające zmagania w kolejnej rundzie WRC - FIA World Rally Championship w klasie WRC3.

Po nocnym odcinku zajmujemy szóste miejsce w klasie.

Trzymajcie kciuki.",2024-10-17
"During the 1939 “America first” Naz! rally at Madison Square Garden,  Isadore Greenbaum, a 26-year-old Jewish man from Brooklyn, charged the stage in protest yelling “Down with H!tler!”",2024-10-09
".@KELLYROWLAND and I know that making your voice heard in a democracy should be a vibe, not a struggle. Mail-in ballots are out, and early voting is ON ! It is BEYOND time for us to rally behind @KamalaHarris —let’s get it done!",2024-10-17
"VP just told some protestors that they had the wrong rally, and that they were looking for the smaller rally down the road",2024-10-17
"Dogecoin price will rally 10x to $1 by December, Shiba Inu will surge to $0.005, while ETFSwap (ETFS) skyrockets from $0.03846 to $35!  #Crypto #Dogecoin #ShibaInu #ETFSwap @mag212news #mag212news",2024-10-17
"Stand up to book bans ahead of our Day of Action rally – this Saturday! – October 19. Pledge your support for the #FreedomToRead and instantly send an email to your elected representatives to tell them how important this issue is to you. 

Take action now: https://on.nypl.org/4eJoNCI",2024-10-17
"""You guys are at the wrong rally...you mean to be at the smaller one down the street."" LOL!!!!",2024-10-17
"Dogecoin (DOGE) Analysis
This week, DOGE, the largest meme coin by market capitalization, gained notable momentum. However, bulls could not push beyond the previously indicated resistance at $0.13 during the attempts to close above $0.105. Once again, the DOGE rally appears to be",2024-10-17
The Queens Opposition to #cityofyes rally Southern Fields 115th and South Counduit 10/17/24 @JoannAriola32 @Stacey23AD,2024-10-17
"I'm attending Million Voters Project's event, “MVPAF Statewide Virtual Rally!” - sign up now to join me! #PowerofWe",2024-10-17
70th Anniversary OCC Macaronesia Rally reaches Tenerife http://dlvr.it/TFSHQt,2024-10-17
Security preparations underway for Trump rally in Latrobe,2024-10-17
"""Oh I think you're at the wrong rally, I think you meant to be at the smaller rally down the road"" Kamala to protestors at her rally",2024-10-17
"ELON MUSK JUST ANNOUNCED HE IS ATTENDING TRUMP’S NEXT RALLY ON OCTOBER 5TH IN BUTLER, PENNSYLVANIA 

THE SAME PLACE HE WAS SHOT AND ALMOST KILLED 

MAKE THIS GO VIRAL BECAUSE WE NEED HUNDREDS OF THOUSANDS TO SHOW UP OUTSIDE",2024-10-04
"I'm going to put together a thread on Trump's rally in Prescott Valley, Arizona. Follow along for clips and commentary.",2024-10-13
"61 years ago today, hundreds of thousands of people marched on Washington to demand jobs and freedom.

That day was a call to action for our nation. It helped rally advocates and elected officials to secure landmark legislative victories in the fight for progress, including the",2024-08-28
"Gunman at Trump’s Coachella rally is GOP

Thugs who attacked our Capitol are GOP

Butler PA shooter is GOP

Guy who attacked the FBI building is GOP

People threatening election workers are GOP

Man who attacked Paul Pelosi is GOP

Violence isn’t a bug of the GOP—it’s the FEATURE",2024-10-14
"Grant Cardone just WENT OFF on Kamala Harris at the Trump rally with no filter

I've never heard so many F-bombs at a Trump rally 

""Donald Trump has given up everything. Almost gave up his life... Put a [Trump] sign in your f-king front yard before they take it from you.""",2024-10-12
"Trump campaign misses Oct. 10 due date, owes St. Cloud $209K for rally - “NBC News recently reported that the Trump campaign owes more than $750,000 to five jurisdictions, with some bills dating back to 2016.”",2024-10-14
"Buying Trump's $WLFI token is like going on one of his buses to his rally.

90% chance you walk back 5 miles afterwards while Trump is flying off in a private jet with your $.",2024-10-17
"'KAMIKAMICA SOUNDS WARNING AS MPS RALLY BEHIND PM | Resign immediately! This was the strong message sent out by The People's Alliance party deputy leader Manoa Kamikamica.

Read the full report in The Fiji Times
#TimesNews #FijiNews #FijiPol",2024-10-17
Did #Kamala tell them they’re at the wrong rally? ,2024-10-17
Kamala's WI rally is on now.,2024-10-17
"I'm an all-America working class undecided voter living in a swing state. At first Kamala's bratposting and coconut tree memes won me over, but after seeing Trump dance to catchy tunes at a rally for half an hour, I'm leaning towards him.",2024-10-17
"Rally time boys!
GO GUARDS",2024-10-17
"This is easily the strangest clip yet from a Donald Trump rally.

That is no small claim.

But check out the moment, at the 20-second mark, when South Dakota Governor Kristi Noem — America’s most famous dog killer — attempts to mimic Trump’s dance moves.",2024-10-15
"This is EPIC! 

New Yorkers at the Trump rally kicked out fake news!",2024-09-18
"Trump statue made out of nails at the rally in Butler, PA ",2024-10-05
" TODAY #IST with @MikeFPrater @Ballgame_KTIK @JPktik on 95.3/KTIK app

CALL/TEXT 208-424-9300

-3: Ashton Jeanty Fandom #BoiseState
-315: Fantasy @rotobuzzguy
-345: Bronco Focus @BsuBob
-430: Prep Rally #EagleHS
-415: Best Bets @paramountsports
-5: Jeanty Fandom @BroncoSportsFB",2024-10-17
"LIVE: Trump Rally in Reading, #Pennsylvania",2024-10-09
"Columbus, Ohio loves Trump! I drive these girls to gymnastics practice 4 days a week and every single day they are putting on their own rally from the car! They get lots of honks (posted this once and it got deleted) I told them I’d tag @realDonaldTrump and @elonmusk",2024-10-17
"VP Kamala Harris and Mark Cuban at Rally in Wisconsin
Is Kamala Harris going to be the next President of the United States... 
HELL YES!!!!!!!!!!!
HELL YES!!!!!!!!!!
HAPPENING NOW!!!!!!!!!! 10/17/2024",2024-10-17
"#SixKingsSlam #RiyadhSeason #tennis 

Crazy rally Nadal vs Alcaraz ",2024-10-17
Concerned residents and members of the South Texas Environmental Justice Network are organizing a rally outside the TCEQ public meeting today at the Brownsville Sports Park Gymnasium to voice their concerns on the SpaceX proposal.,2024-10-17
MAGA rapper complains women are 'Trump bigots' at Georgia rally,2024-10-17
" #Silver's been stuck for 5 months, but Jesse Colombo of Money Metals Exchange believes a breakout is near! Patience could pay off as conditions align for a rally past the $32.50 resistance. Ready for a silver surge? #Investing #PreciousMetals",2024-10-17
