Tweet,Date
"Secret Service Director goes on national tv and says to expect a geopolitical event that will launch us into a kinetic war.

How convenient.",2024-09-18
$TLT went right down and tested Thursday's 93.41 and held at 93.42. $SPY likes it. Will be interesting to see if it tests again and how $SPY reacts to that test result. $XLE still moving back toward the 94 level as expected for another test there. Any geopolitical event sends it.,2024-10-11
"Geopolitical opportunism has been chronically overplayed. Russia's annexation of Crimea and Black Sea foothold was not rationally worth the cost of Western sanctions. 

Even in Syria, Russia embarked on a potentially high-risk, uncertain reward mission that ended up succeeding /3",2022-03-08
"TD Securities 1/2: There had simply been lots of bad news priced into the USD, increasing the risks that a string of good news will kick-start a sizeable correction and evidence for that is emerging. There is also enough event risk (geopolitical and US political) on the horizon",2024-10-14
Some geopolitical event...,2024-09-17
 NEW: Ukrainian Intelligence Agency says that the events in Moscow are a 'conscious provocation' by Russian special services – Reuters,2024-03-22
A Major Geopolitical event,2024-10-03
"""Putin fell for it and fell for the deception again for the fourth time.

""The naivety of Russians is simply amazing.""

This is facile nonsense, in my view.

The conclusion that Putin was ever once deceived by western treachery is so manifestly false.

Oh, sure, Putin has",2024-08-10
"Secret Service Director Makes Cryptic Reference To Coming 'Geopolitical Event, Kinetic Conflict' That Could Endanger US Leaders",2024-09-22
"The Diplomatic winds are shifting heavily in Europe. 

The United States and Russia have just exchanged multiple high level prisoners with Turkey being the third party. 

Zelensky is openly suggesting Russia attends the next peace summit and that territorial concessions may need",2024-08-01
"-         End of the current development model and slowing down of the economic growth

The protests and unstable situation in China, as well as Erdogan preparing for the military operation in Syria, are major international geopolitical factors that need to be considered.",2022-11-29
"the most important geopolitical event since the fall of the USSR. They will not do huge harm to Russia. Russia is self-sufficient in many things, especially the 2 most critical ones, food & energy. Energy is the economy. Food represents a level of govt stability. 
2/",2022-03-26
"If this report is accurate & happens, this would be a historic geopolitical event….",2024-10-04
"Major events these days :
end of petrodollar
decoupling EU-Russia
Russia full shift Asia
India, Brasil siding with Russia.
EU becoming US 51st state, full vassalisation
confirmation of Western hypocrisy and racist project.
Humiliation and near end of NATO
end West freedom speech",2022-03-15
"During the Cold War, several crises of this nature occurred.

These scenarios are referred to as ""risk-taking competitions"". This type of crisis involves at least two nuclear powers and tends to escalate until one side gives in, leading to a de-escalation of the crisis.",2024-03-26
"Many people are fighting for sovereignty inside the Western liberal dictatorships and some people are fighting to import the Davos sponsored Western totalitarianism into their sovereign nations, so the conflict is not just geopolitical but it is de facto a worldwide civil war.",2022-08-20
