Tweet,Date
"Democrats Just Convicted Donald Trump Of 34 Felonies

Here’s Paula Jones publicly getting paid off from Bill Clinton proudly displaying her check

This is America’s Two-Tier Justice System

She was paid $850k by then-President Bill Clinton to settle her claim of sexual assault",2024-05-30
120 additional sexual assault allegations are being filed against Diddy ,2024-10-01
"Biden’s biggest scandal: fell off a bike

Obama’s biggest scandal: wore a tan suit 

Trump’s biggest scandals: incited an insurrection, found liable for sexual abuse, tried to overturn a fair election, admitted to sexual assault, stole classified documents, criminally indicted,",2023-05-22
"Here i am delivering the letter to oust U.S, Ambassador Marie Yovanovitch form “unindicted co-conspirator-1” Congressman Pete Sessions to twice impeached, 4 times indicted, found guilty of fraud, and sexual assault Donald Trump! 
#LevRemembers #ShadowDiplomacy",2024-03-25
"Cardi B admitted to drugging and robbing men. Her YouTube is perfectly fine and being monetised. 

Russell Brand has be accused of sexual assault and YouTube have stopped his monetisation. 

The agenda is crystal clear at this point.",2023-09-19
"i have never heard an antizionist or leftist wish sexual assault on a protestor on the other side of any action. i have seen the reverse happen countless times irl and on video, though",2024-04-29
Hosted a slut walk for women’s empowerment while endorsing a man with several sexual assault allegations is the most ass backwards shit I’ve ever seen.,2024-07-16
"Have you grabbed your ticket yet? 
Ticket sales end in just a few hours. Don’t miss out! 
Hurry and secure yours now! 
Help us wrap survivors of sexual violence in our community's care.
#sascgala #communitysupport",2024-10-17
"Senator @Scott_Wiener claims @Riley_Gaines_ is just a “cause celeb” as he is pushing for girls to be subjected to injuries, loss of spots on a team, and sexual assault in locker rooms by his want for boys in girls sports. 

Disgusting behavior by a 53 year old man who has no",2024-03-26
"When you find yourself obsessed with conspiracies of Ashley Biden’s diary, Hunter Biden’s genitalia and pizza rings but ignore Trump’s actual statements about his daughter, testimony of his sexual assault victims. You’re part of a cult. Republicans have no policies, solutions",2024-04-10
"Remember when Trump had sex with a porn star right after his wife had given birth to their son? I do

Remember when a jury found Donald Trump liable for sexual assault? I do",2024-09-17
"DETAILS: Profits from 50 Cent's upcoming documentary about Diddy will go to victims of sexual assault and rape. 

https://bit.ly/46BcL9C",2023-12-07
Just a reminder that alcohol is the most common drug used in sexual assault crimes.,2023-08-03
"Marjorie Taylor Greene comparing trump to Jesus should have gotten her booed and thrown out.

Instead, the cult just cheered.

But she couldn't be more wrong, unless you think Jesus committed sexual assault, fraud, and dozens of other crimes.",2024-06-10
"BREAKING: In a stunning moment, Donald Trump just incoherently rambled about someone accusing him of sexual assault. Trump is senile, disgusting, and cannot be allowed back in the White House. Retweet to make sure all Americans see this.",2024-09-06
"Houston Police Chief admits over 4,000 sexual assault cases were not being investigated:",2024-02-23
Tithe money for sexual assault insurance sure makes sense,2024-10-17
"Imagine being so worried about Taylor Swift endorsing your opponent that you have to pretend that she wants you to win!

Swift should sue him for whatever he has left after his sexual assault victims get their share.",2024-08-19
"Trump got sexual assault allegations, is a felon, plays into violent racial ideologies, and is a proven liar….for Kamala y’all argument is “she’s not black” very unserious nation this is ",2024-10-14
"You ever notice the celebrities (specifically rappers) that support Trump always have at least one of the 3 things in common with him.

1. Scammer 2. Felon 3. Sexual Assault Allegations. https://x.com/nojumper/statu/nojumper/status/1812519403952779361…",2024-07-14
"A South Tyneside sexual assault investigation is underway as police release an image of a man and appeal for information. 

The incident, which took place between 8.45pm and 9pm on Thursday, August 29, left a 12-year-old girl shaken.

It was reported that a man had approached two",2024-09-06
"HOLY MACRO, karma is about to get Fani Willis.

Fani Willis received a letter from the United States highlighting her misuse of $500,000 for Youth Empowerment and Gang Prevention Center and $2 million for the Sexual Assault Kit
Initiative.

Will Democrats protect her or will she",2024-05-21
"Donald Trump has been prosecuted for national security crimes, economic crimes, election interference—and has been found liable for sexual assault.

Let’s be clear: I will always stand for the rule of law.",2024-09-11
"This is the 2nd time I am posting this today because I want you to understand how serious this is.

Released today from the ICE Deputy Director:

13,099 illegals convicted of homicide.
15,812 illegals convicted of sexuàl assault.
425,431 CRIMINALS in the United States.

This is",2024-09-27
"Reform voter I blame the immigrants.

""I've got a criminal record, SEXUAL assault.""

Of a 7 year old girl.

Nobody wants to hire a paedophile, that's the problem.",2024-06-22
he specifically wants to put victims of sexual assault to d3@th. Because literally every woman who comes forward is accused of being a “false accuser”,2024-10-17
DEVELOPING: There is a documentary titled “Quiet on Set” coming out that is exposing the pedophilia in Nickelodeon which hints of Dan Schneider's on set behavior and talks on the topic of sexual assault. It will air on March 17th.,2024-02-17
"Can we all please agree not to repeat this idiotic experiment where we give a dumb orange TV host and shady real estate developer with no government knowledge, 6 bankruptcies, 42 sexual assault allegations, 7,384 lawsuits, and $5,563,000,000 in debt our nuclear secrets? #TrumpOnX",2024-08-12
"In 2022, Denmark was ranked as the fifth safest country in the world, only surpassed by Iceland, New Zealand, Portugal, and Austria. 

It has been ranked as one of the safest countries for women, with very low rates of sexual or domestic assault/violence.

Things change, today",2024-07-04
Sexual assault!! https://x.com/cherriesren/status/1842033586041413871…,2024-10-15
Listen to this victim's account of Tim Walz sexual assault of him as a former student before they take it down.,2024-10-17
"In released hostage Aviva Siegel's first full interview on Israeli TV since her release, she recounted more details of sexual assault of young female hostages, who were forced to dress in tiny clothes, watched as they showered, and beaten with sticks by armed Hamas militants.",2024-02-17
"Republican Rep. Nancy Mace: I’m voting for Trump because ""as a woman, I want to vote for someone who will protect women like me who are survivors of rape""

27 women have accused Donald Trump of sexual assault, and a jury in NY found him liable for rape.",2024-08-30
"Hamas had a detailed plan for the raping of Israeli girls; including which Hamas commander would rape girls in the different locations in Israel.

An Arabic-Hebrew sheet found on the Hamas terrorists included words meant for sexual assault like “take down your pants.”",2023-11-12
not the 34 felonies... 2 impeachments... 1 judgement of sexual assault ... or insurrection,2024-09-16
"How about we publicly execute any preacher found guilty of molesting children, maybe that will slow them down. More preachers molest children than women falsely report sexual assault. 
#VoteBlue2024ProtectWomensRights",2024-10-17
"SCOOP: This is from the Air Force and Space Force training for Sexual Assault Prevention and Response.

They claim that one of the characteristics of a perpetrator of sexual assault, is “adherence to traditional gender norms.”",2023-10-06
.@KamalaHarris shares that her best friend in high school was being molested by her father.  She went on to specialize in child sexual assault cases as a prosecutor.,2024-07-26
"How far has trans mania gone? 

Virginia school ""transitions"" a girl without parents knowing.

She gets threatened with sexual assault for being in the boys bathroom, which the school encouraged her to use. 

She runs away, gets kidnapped and raped by multiple men.

When rescued,",2023-09-10
BREAKING: Mika Brzezinski just slammed the media’s hypocrisy over relentless coverage of President Biden’s debate while ignoring that Donald Trump is a convicted felon who was found guilty of sexual assault. Retweet to ensure all Americans see this.,2024-07-04
A fan who attempted to kiss and sexually harass Jin of BTS during an event is reportedly facing sexual assault charges.,2024-06-14
That’s sexual assault,2024-08-16
Your kids are watching. What will you tell them if you vote for a convicted felon who was found to have committed sexual assault?,2024-06-11
"Woman claims she was sexually assaulted by eight hockey players at house she shared with her boyfriend: The Ontario Hockey League put out a statement that it learned of sexual assault allegations from a 32-year-old woman, with the junior-hockey league… http://dlvr.it/TFSQbJ",2024-10-17
" President Trump reacts to the BOMBSHELL report from ICE that Kamala has released...

— 13,099 convicted murders

— 25,272 illegals convicted for rape & sexual assault

— 425,431 convicted criminals

— 222,141 illegals with pending criminal charges",2024-09-27
"Commanders are releasing kicker Brandon McManus, who is being accused of sexual assault in a lawsuit filed last month.

Commanders continue OTAs on Monday and they do so without currently having a kicker on their roster.",2024-06-02
"Laughably, the adjudicated rapist who bragged about sexual assault and overturned Roe “thinks” women will vote for him.

Dumbass, sexual predator motherfucker about to find out.",2024-09-21
"Ten women — including employees and women who lived in shelters run by Mr. Rivera’s organization, the Bronx Parent Housing Network — had accused him of sexual assault or harassment, The Times found.",2024-10-17
The Police Officers Association of Michigan endorses a man found liable of sexual assault who is facing 88 felony charges to be the president of the United States.,2024-04-02
"Bill Maher asks Nancy Mace about her interview with George Stephanopoulos:
""He was questioning you about the idea that you're supporting Trump who was found guilty of sexual assault by a jury and you're a rape victim yourself.""
Nancy Mace: ""Donald Trump wasn't convicted of sexual",2024-03-16
"You know what’s really weird? As soon as you had sexual assault allegations thrown at you, you jumped on the far right wing bandwagon.  That’s weird.",2024-07-31
"The guy who’s lying about the election he lost, the insurrection he incited, the sexual assault & business fraud he committed, the extorting phone calls he made, the affairs he had & the hush money he paid, wants you to know that Kamala Harris is “lying” about cooking fries.",2024-09-28
"Usually they didn’t consent, but because the assault isn’t violent or the person was nice after being told no and doing it anyways a lot of girls especially young women don’t realize that it was assault until they learn more about SA.",2023-01-31
"This woman showed pictures of her bruises and medical report, yet she is being told her story doesn’t “add up”. No, she was sexually assaulted in a hotel room she paid for, nothing about that adds up!",2023-06-19
"Ou o cara furou a camisinha engravidando ela sem permissão, o homem acaba a abusando enquanto a mina dorme ou simplesmente ela é agredida sexualmente na rua por um estranho qualquer.

Esses 3 exemplo são assédios onde a mulher é violada.

Nem tudo é sexo no pelo",2024-03-14
This is rape. Waking up to a man who is nonconsensually penetrating you is rape.,2023-06-15
"Actualmente la AGRESIÓN sexual tiene lugar cuando se atenta contra la libertad sexual con violencia o intimidación (un puñetazo, una amenaza).

El ABUSO sexual es cuando se atenta contra la libertad sexual sin violencia ni intimidación (tocamiento o beso no consentido).",2022-08-25
"Gracias @laencerronaperu x desmitificar la violación sexual, a propósito de la denuncia de Farfán contra su primo. Grábenselo: violación es acceso carnal no consentido. Clave SIEMPRE es consentimiento. No suele haber violencia física. Ocurre en casas y agresor suele ser conocido.",2024-10-03
See also: intimate care. *Anyone* male providing intimate care to a woman who has not consented to receiving that care from males is sexually assaulting them.,2024-01-11
"Diddy has been sued by a former model who claims he drugged and sexually assaulted her in 2003. 

This is the sixth sexual assault complaint filed against Diddy in the last six months.",2024-05-21
"trigger warning: sexual assault

there’s a reason i don’t call myself a leafs fan despite liking their players and that’s bc of  how disgusting the fanbase can be towards mitch marner but it reached a new low there’s actually people hoping he’s a rapist now after the new article",2024-10-17
"BREAKING: Drag Queen 'Shangela' who was invited by Kamala Harris to the White House to celebrate Pride Month was just accused of multiple s*xual ass*ults.

https://rollingstone.com/tv-movies/tv-movie-features/shangela-rupaul-drag-race-sexual-assault-1234974148/…",2024-03-18
"Diddy is facing his 7th sexual assault lawsuit in the past six months. 

A woman claims he drugged and assaulted her multiple times starting in 1995 — on one instance forcing ecstasy down her throat and demanding she have sex with Kim Porter in front of him, TMZ reports.",2024-05-24
"When did you become anti-Trump? When he … 
A) came down the escalator
B) gassed peaceful protesters
C) caused January 6
D) was found liable of sexual assault 
E) stole national secrets
F) guilty on 34 counts 
G) guilty of fraud $500M
H) sorry, ran out of room for his indecencies",2024-08-27
"The one old man has stepped out of the race. 

How about the other old man who was convicted of 34 felony counts and found liable for fraud and sexual assault?

You guys are against old men being president right?",2024-07-21
"The sad saga of RFK … this guy labeled everyone corrupt… but after the sexual assault allegations, the dead bear cub in Central Park, the sawed off whale head, and now the allegations of an extramarital relationship with a reporter during the campaign it proves two things … he",2024-09-20
"He was found liable for sexual assault and you are still ok with him.  He launched an assault on our Capitol and you still support him.  He told over 30,000 PROVEN lies and you still say he’s your guy.  Basically there is no bottom for you. You ARE what’s wrong with America.",2023-12-23
"Imagine the meltdown of both the media & the GOP over Kamala Harris if she were an old, smelly TV host, rapist, convicted felon, and traitor to our country with 5 children from 3 marriages, 6 bankruptcies, 42 sexual assault allegations, 7,384 lawsuits, and $5,563,000,000 in debt.",2024-07-23
(Updated) Lawyer: Woman alleging sexual assault by OHL players weighs next steps. https://barrie360.com/woman-alleging-sexual-assault-ohl-players/… via @Barrie360,2024-10-17
"‘Drag Race’ star Darius “Shangela” Pierce faces new sexual assault allegations, with Dakota Payne being the sixth victim to come forward.",2024-09-21
"I hate the whole conversation around forgiveness. 

Especially for heinous things like murder or sexual assault. 

Forgiveness is a personal journey. 

If someone chooses to forgive that is fine. 

If someone chooses not to forgive that is also fine. 

I’m a big believer that",2024-10-17
"We’ve seen horrific reports of sexual assault by Hamas on October 7th. It is reprehensible and must be condemned. 

Rape can never be used as a weapon of war. I’ve spent my career protecting women and girls from heinous crimes of sexual violence and will continue to do so.",2023-12-07
Donald Trump has been found guilty of 34 Felonies. He’s been found guilty of Business Fraud. He’s been found guilty of Sexual Assault. This man can be not allowed anywhere near the White House.,2024-06-17
Police statement after officer spared jail for sexual assault,2024-10-17
"Not all men are rapists
but 99.9% rapists are men

100% of the women face some perverted touch or gaze in their daily life.

99.9% of the victims of sexual assault are always women.

So yeah, not all men are rapists, but all rapists are almost always a man.",2024-08-15
"I mean, Trump is literally a convicted felon who was found liable for sexual assault.",2024-08-11
"'SCRUBS' PRODUCER CHARGED WITH 28 COUNTS OF RAPE AND SEXUAL ASSAULT

Eric Weinberg, a 63-year-old Hollywood producer known for his work on ""Scrubs,"" has been ordered to stand trial on 28 charges, including rape and sexual assault.

The charges stem from incidents between 2014",2024-05-22
"VANCE: What the American people don't want to talk about is weird juries in NYC.

STEPHANOPOULOS: So juries are not legitimate when they find someone liable for sexual defamation and assault?

VANCE: Absolutely. @atrupar",2024-09-21
"Donald Trump brutally raped his first wife, Ivana. She described in raw detail the violent sexual assault in her divorce deposition.

Now Trump is suing a filmmaker for exposing him in a new movie called ""The Apprentice"".

Donald J. Trump is a rapist.",2024-05-21
Something tells me @joelwebbon is dealing with sexual assault lawsuits,2024-10-17
"‘Federal authorities have been investigating sexual assault and sex trafficking allegations against WWE co-founder Vince McMahon, according to people familiar with the investigation.’

‘Prosecutors in New York in recent months have been in contact with Women who have accused",2024-02-02
"Especially on a day like Father's Day, our kids are watching. What will you tell them if you vote for a convicted felon who was found to have committed sexual assault?",2024-06-16
"Call me crazy, but maybe it’s because one of them is a convicted felon who was found liable of sexual assault and fraud, and who has multiple other criminal cases open against them. Could that be the reason why the media reports more negatively on Trump?",2024-08-21
"BREAKING: A former student has accused Tim Walz of sexual assault when he was just 14. The details are shocking & could be the end for the Harris campaign. She dug up all the  publicly information currently available and put it all in one easy to follow video. It's long, but",2024-10-15
 ISRAELI MEDIA ADMITS that there is NO EVIDENCE of mass sexual assault on October 7th.,2023-11-10
"President Biden: I pointed out last night that the only convicted felon on the stage was Donald Trump. I thought about his 34 felony convictions, his sexual assault on a woman in a public place, being fined $400 million for business fraud. I thought to myself, Donald Trump isn't",2024-06-28
"One of the best pitchers in baseball is currently playing in Japan because of a false sexual assault allegation.

The guy nicknamed ""Punt God"" is currently not on an NFL roster also because of a false sexual assault allegation.

Both of the women who falsely accused them have",2023-10-04
"The “it wasn’t rape, just sexual assault” crowd is so warped.",2024-03-11
Trump brags about making it harder for women to come forward about sexual assault on college campuses,2024-05-26
"Singer Niykee Heaton describes her sexual assault by P Diddy and Kanye. 

The other men who ignored her and did nothing to help her are cowards.

She needs to expose all of their names.",2024-10-15
"Donald Trump posted this unhinged, all-caps rant about how only he can make women happy and ""PROTECT"" them. Remember, he's an adjudicated rapist, accused of sexual assault or misconduct by more than 20 women, and he's the reason that one-in-three adult women now live under a",2024-09-21
"Top Trump advocate says IVF is “immoral,” compares it to sexual assault

This echoes the Project 2025 plan to restrict reproductive rights nationwide if Trump wins",2024-02-27
"NYC HERO!

This is Jeffrey Flores who restrained Christian Geovanny Inga who was wanted for the brutal sèxual assault of a 13 year-old girl at a Queens park.",2024-06-18
"“It wasn’t a pet, it was a working dog.”

“It wasn’t rape, it was sexual assault.”

Same energy.",2024-04-28
New film returns to Trump’s sexual assault trial and E. Jean Carroll,2024-10-17
"A pregnant woman is sexually assaulted on a train by a man & the judge’s bizarre priority is that finding him guilty, will adversely impact his life. 
It’s a man’s world alright.",2024-08-18
I really want to like Sword Art Online because I desperately miss what .Hack did for that genre but like it’s so hard to like SAO when it’s a harem style show AND there is sexual assault every season. Like shit makes me roll my eyes to the back of my skull.,2024-10-17
"Conservative Christian MAGA Republican @NeilFriske voted for marital rape, for child  marriage, and for revenge porn. He's been arrested and reports says he is being charged with sexual assault of a prostitute. More of those @GOP family values on display.",2024-06-21
"""No presidential candidate has ever been under a gag order."" trump, 2 minutes ago

He is CORRECT.

No presidential candidate has been:
- Impeached twice
- Found liable for sexual assault
- Indicted for 88 felonies
- Convicted on 34 felony counts

This deranged, delusional CONVICT",2024-05-31
"Bill Maher celebrates London going from 86% white to 36% in a few decades:

""It’s a happy fact"" 

Is it also a happy fact that London just hit another record high for rape and sexual assault?",2023-11-08
"Really nuanced discussion on First Take between SAS, Domonique Foxworth and Shannon Sharpe about Tyreek Hill’s detainment video. There are some parallels between how this issue is discussed and how we discuss women and sexual assault. The burden of de-escalation and safety is",2024-09-10
"#nfl #GoPackGo 

The Green Bay Packers have signed kicker Brandon McManus, with general manager Brian Gutekunst expressing confidence in the decision despite past sexual assault allegations. The NFL's investigation found insufficient evidence to…",2024-10-17
"Romney: I am not going to be voting for Trump… When someone has been determined by a jury to have committed sexual assault, that is not someone who I want my kids and grandkids to see as President of the United States.",2024-05-16
"In court documents obtained by ESPN, Dwight Howard said Monday that he engaged in ""consensual sexual activity"" with a man named Stephen Harper during a July 2021 encounter at Howard's Georgia residence, per @Baxter 

“Dwight Howard has denied sexual assault and battery",2023-10-25
"Biden: The only convicted criminal on that stage was Trump. When I thought about his 34 convictions, his sexual assault on a woman in a public place, his being fined for business fraud.. I thought to myself Trump is not just convicted felon, he’s a one man crime wave",2024-06-28
"WATCH: @TuckerCarlson exposes Nikki Haley’s donor Reid Hoffman 

“He’s a friend of Jefferey Epstein. He was a visitor to Pedo Island, in fact. He’s also the guy who funded E. Jean Carrol’s sexual assault case against Donald Trump”",2024-01-16
"TW: Sexual assault  

A male Nova survivor has come forward anonymously to offer testimony to Israeli TV about his rape at the hands of Hamas terrorists on October 7th. 

""It's a very difficult moment”

“They were in a crazy state of intoxication, celebrating, laughing with",2024-07-23
Luis Aguilar pleaded guilty to three counts of sexual assault in exchange for three concurrent 20 -ear sentences,2024-10-17
"NEW AD: Donald Trump is a convicted felon who has been found liable for sexual assault and committed financial fraud.

This election is between a convicted criminal who’s only out for himself and a president who’s fighting for your family.",2024-06-17
Rep. @MadeleineDean: I find Trump's statements on being a 'protector' creepy. Women don't want Donald Trump's protection. We want our rights. We want our freedoms. This is coming from the man who was found responsible for sexual assault. He's not a protector. Tell that to the two,2024-09-26
"The Trump rap sheet:
Liable for sexual assault
Liable for defamation x2 (>$80M)
Liable for fraud- amount TBD
Trump Org criminally guilty of multi-year tax fraud
4 grand jury indictments/91 felony counts- pending",2024-01-27
"If you’re attending a #TrumpRally today, May 11th 2024, after he’s been convicted of sexual assault and fined $83M, then you’re 100% in a bonafide cult, and the rest of us enjoy making fun of you.",2024-05-11
"Romney: “I will not be voting for former President Trump. I must admit I find sexual assault to be a line I will not cross”

Great news. Trump 2024.",2024-02-17
One male arrested today for Sexual Assault on Park Road North W3. Officers assisting our Trainee Detective with the arrest. Also a group of Street removed from Woodlands Park W3 #Acton #Ealing,2024-10-17
"Please, can we take a step back and look at the structure of the 2024 presidential race? 

A man found liable for sexual assault that the judge called “rape” is the Republican nominee. 

A man convicted of 34 felonies and is running for president out on bail is the Republican",2024-07-13
