Tweet,Date
"File under Double Standard: Biden has committed no crime at all but is guilty of being old: Trump is charged with 91 of the most serious crimes imaginable (which he is stalling at every turn) and is liable already for fraud, sexual assault and defamation.",2024-02-09
"BRENNAN: Trump just finished a press conference, three quarters of which was about grievances about his past conviction for sexual assault. What is the message to female voters?

NIKKI HALEY: I think the focus, for me, is about policy",2024-09-08
"Can we please all agree that this experiment of giving a dumb TV host and shady real estate developer with no government knowledge, 6 bankruptcies, 42 sexual assault allegations, 7,384 lawsuits, and $5,563,000,000 in debt our nuclear secrets did not go well at all? #TrumpTrial",2024-04-15
"CPAC: Accused of sexual assault
Moms4Liberty: Accused of sexual assault
Trump: Accused of sexual assault
TPUSA: Accused of sexual misconduct 
Club for Growth: Accused of sexual misconduct
NRA: Accused of sexual harassment 
FRC: Accused of sexual misconduct 

Did I miss any?",2023-12-02
"There is now overwhelming evidence of rape and sexual assault of Palestinians by Israeli forces in Gaza, and of sexual abuse of Palestinian kids in the West Bank.

Notice the deafening silence on this. 

Why?

Because they don’t see Palestinian women and kids as humans.",2024-03-24
"Four men and two women have filed new sexual assault lawsuits against Diddy. 

One of the men claims he was 16 at the time of the alleged assault.",2024-10-14
"From Israel’s Haaretz newspaper, auto-translated from Hebrew:

“The police are having difficulty locating victims of sexual assault or witnesses to acts from the Hamas attack, and are unable to connect the existing evidence with the victims described in it.”

Those of us who have",2024-01-04
"Let’s make a new rule. Anybody who is over 75 years old shouldn’t be running for president.

Anybody who is convicted of a felony shouldn’t be running for president.  

Anybody found liable for fraud or sexual assault should not be running for president. 

Does this sound fair?",2024-07-22
"The leading Republican candidate has been found liable for sexual assault and fraud, his companies found guilty of fraud, and he's charged with 91 OTHER felony counts.  
That he is not dismissed politically out of hand says much more about us, than about him.",2023-09-26
"How ever bad you think it is…it’s worse.

Trump’s sexual assault. More victims. Payoffs. J6. Felonies.

I ANALYZED the J6 call records. We know how many calls were between the WH and organizers, ground participants & those connected to PB & OK.

We haven’t done enough. Vote.",2024-09-22
Michigan prisoner Derrick Lee Cardello-Smith wins $100 million default judgment against Sean ‘Diddy’ Combs in sexual assault case,2024-09-10
"I’m going to vote for the old man who’s decent, kind, honest, thoughtful, intelligent, compassionate and patriotic — NOT the old man who’s racist, corrupt, idiotic, greedy, self-serving and traitorous (not to mention guilty of sexual assault).",2024-02-09
"TMZ reports that Matt Riddle’s sexual assault claim at JFK airport has triggered the launch of an internal investigation.

Law enforcement sources say Port Authority officers got a call for a disorderly person who was deplaning, and they met him in the terminal. As it turns out,",2023-09-10
