Tweet,Date
"This is civil war, we are having a civil war

@knrd_z has a bunch of great threads about how the violence of civil war / revolutions in various countries is largely just a jubilee for murder, people settling petty disputes and jealousies with their acquaintances with impunity https://x.com/mollycrabapple/mollycrabapple/status/1594701481512517633…",2022-11-21
"More than a dozen civilians are sh0t dead by criminals in Begusarai, Bihar.. They’re openly firing since last 2-3 hours & govt-police are sleeping..

In 90s such things used to be normal, seems like Nitish-Tejashwi will make it a new normal in 2022 as well.",2022-09-13
"7/ As well as resulting in violent crimes not being investigated or solved, the crisis is leading to a surge in police violence and corruption, as officers attempt to beat confessions out of suspects and carry out arbitrary arrests to meet quotas.",2023-10-01
"13 civilians, including 6 children and 4 women were killed. or as the US calls it, ""collateral damage""",2022-02-03
"Over the past year, Israel has repeatedly bombed civilian areas with near zero regard for collateral damage. At every off-ramp, Israel has chosen violence over peace.",2024-10-05
"It’s the highest rate of civilian casualties, and the worst civilian-to-military ratio, in any conflict involving a First World “democracy” in many decades. They killed more civilians in the first month than Russia killed in two years fighting a broad front war in Ukraine.",2023-12-02
"Roughly 2k civilians have been killed each year on average, due to armed conflict within Ukraine, since the 2014 coup.

The gov't of Ukraine (in alliance with fascist militias who do its bidding) have straight up committed documented war crimes against civilians.",2022-02-26
"More civilians have been killed in this conflict as a percentage of population that in any other conflict in the 21st century. 
They regularly violate the Geneva Convention, and with the attack on the Iranian Embassy, violated the Vienna Convention. 

Stop running cover for war",2024-04-04
"(2) Agressiveness and violence feels worse than in previous times. Can’t say anything on the street even if someone is wrong. Lots of aggressive behaviors in the streets, more guns and more crazy senseless homicides due to small fights and traffic accidents, for example",2022-08-12
The violence is coming from the Police. Every single death or injury has occurred at the hands of police. Don't pretend to be new here.,2024-07-16
"It’s especially hard to show compassion given the brutality Putin and his military unleashed on Ukrainians. Bombs and shells have razed entire towns. According to the @UNHCRUkraine, “1,123 civilian casualties in the country: 364 killed and 759 injured” — likely an undercount.",2022-03-07
#CeseMultilateralEs || Es un error ver el conflicto como un fenómeno esencialmente rural. Cali (por ejemplo) dobla la tasa nacional de homicidios y aportó más de 1.200 muertos al total en 2021 la gran mayoría relacionados con narcotráfico.,2022-09-23
"Also, during the past 24 hours, there have been 117 civilians killed and 152 more injured by the occupying forces.",2024-02-12
