Tweet,Date
"Tim Walz has Bill Clinton talking now during his ""rally.""  Takes a rapist to speak for a rapist.",2024-10-17
"And now a live look at the Tim Walz rally in Tucson, AZ. Very weird.",2024-10-09
jesus fucking christ you're at a presidential campaign rally and you're READING OFF YOUR PHONE? i know the advance team is SEETHING rn,2024-10-17
"NRA cancels Trump rally in Savannah
The decision comes during the same week that the Trump campaign canceled multiple interviews with major news outlets, including NBC News, CBS News, and CNBC, citing scheduling conflicts in most cases.
WHAT ARE THEY HIDING????",2024-10-17
I’m in Savannah today and @carlapeay1 is in Winston-Salem covering #KamalaHarris rally #politics @theatlantavoice,2024-10-17
"Getting ready to join @TTCRiders, @ATUlocal113 for @EnviroDefence at our Rally to Fix the TTC.  @SeanFraserMP must at least double the Canada Public Transit Fund, fund operations & make funding conditional on allowing mid-rise buildings around all bus stops and transit station.",2024-10-17
"#AER2024
Motul Xtreme Rider FR",2024-10-17
"When things just aren't going well for you....

""Not able to run for two weeks"": Trump cancels NRA rally appearance amid decline concerns https://msn.com/en-us/news/politics/not-able-to-run-for-two-weeks-trump-cancels-nra-rally-appearance-amid-decline-concerns/ar-AA1sslnk?ocid=socialshare…",2024-10-17
"Yesterday was a pretty incredible news week. Here's a recap:

- VP Kamala Harris did a rally with Oprah, it was a hit!
- Trump said anti-Semitic things to Jewish people at an anti-anti-Semitism event
- Trump's anti-Semitic endorsement who became the NC gubernatorial nominee Mari",2024-09-20
"#AER2024
AER 2024 - ZOOM FR",2024-10-17
"We've 11yo Annie again as mum's at work. ""Auntie Sarah... It's Friday tomorrow so I've no school work. Can I stay up late to watch rest of the Kamala Harris rally? She won't dance for ages like Trump did.""

Even an 11yo British girl knows just how important this US election is!",2024-10-17
"WATCH: “Absolute chaos… all of us are stranded here… the parking lot is a 2 hour walk…”

MAGA faithful were stranded after Trump’s Coachella rally last night, including many elderly folks. Bussed in but not bussed out.",2024-10-13
"Lamentable formato del Rally RACC haciendo 3 tramos a 2 pasadas, que es el mismísimo RACC y no el rally de mi pueblo",2024-10-17
Trump Derails His Own Rally With Bizarre Old-Man Tangents - The New Republic,2024-10-17
Chris Rock tells Oprah Winfrey at the Unity For America rally that he wants to bring his daughters to the White House to meet the black woman president.,2024-09-20
"Btc about to rally 

Maybe alts will join this time",2024-10-17
"My stage, I always think I’m doing a bad job in the rally, then I rewatch the VOD or while I’m in editing, I realize… 

I’m still bad. JUST better than the day before - I’ll take that any day.",2024-10-17
"""trump knew members of the crowd at his rally near the White House on 6 January were armed, but demanded security apparatus be removed to allow them closer, and then instructed the crowd to march on the US Capitol, a witness told the January 6 committee.""",2024-10-17
"It would appear Trump doesn't have the stamina to even do his scheduled events.  He's already canceled 6 events and now has canceled a 2nd amendment rally in Savanah, Georgia.  Couldn't find a more Trump friendly venue.",2024-10-17
such a masterpiece lit rally şu ikilinin tüm kavgaları kusursuz,2024-10-17
"$ETH

""Regain ~2.6k and we break 3 month POC, 2 EMAs & downtrend""

We have been met with resistance here as expected 

Once cleared (seems to be within a few weeks) it will be an easy trade to 3k 

Thats just step 1, for any substantial rally, $ETHBTC must bottom",2024-10-17
"Minnesota city says Trump campaign still owes more than $200,000 for July rally",2024-10-17
"If Fundstrat's Mark Newton is correct about a Fibonacci retracement of at least 38.2%-50% of the August rally to 5500-5575, it'd place the S&P right around support in the ascending wedge it's traded in since 2023. I'm trimming positions every day building my cash position. 

#SPX",2024-10-17
"The question is not when the rally will start, the question is whether you are really ready for the rally. It is whether you have enough #𝕍eChain for it. 

 #𝕍ET  is the transformation of Blockchain technology into reality .

GN",2024-10-17
There is no better event to be at then a Trump rally! #Trump2024,2024-10-17
"It's time to rally for the Anice Read Silent Auction! Help @TexasDowntown make a BIG impact on downtown projects across Texas by donating a silent auction item TODAY from your community or business. We appreciate y'all supporting Anice Read's legacy!
#TXD24 #GrantFundraiser #TXD",2024-10-17
"PARKING GARAGE RALLY CIRCUIT

Retro-style racing game where you compete on a variety of courses set in multi-story car parks

[ PC, Linux / 2024 / @walaber ]

https://walaber.com/parking-garage-rally-circuit…",2024-10-17
NRA cancels Trump rally in Savannah - The Atlanta Journal-Constitution,2024-10-17
"Looking ahead to Saturday. 

Make sure to bookmark and add to your game day schedule. 
#CFB25 | #Razorback | #Arkansas",2024-10-17
"This is the reason why you should never bother yourselves with Nigerians and their perpetual sufferings especially if you are in diaspora 

Just look at that crowd at an APC rally in 2024 and realize how useless so many Nigerians truly are",2024-09-15
Watching #KamalaHarris Rally! Get fired  up & #VoteHarrisWalz2024,2024-10-17
" $QUBIC 

I'm sure that Anna will be the first catalyst for the start of the rally of $QUBIC. 

We are only at the beginning. 

#BuiltDifferent
@_Qubic_
@c_f_b_token
@c___f___b",2024-10-17
"This counts as a red day. Pre-congrats on the relief rally tomorrow for free money friday.

$SPX $SPY $QQQ",2024-10-17
$GLXY $BRPHF healthy pullback / retest. We all want moon but this rally has been much more sustainable. It’s been a slow grind higher and higher. As a result when $BTC does finally run Galaxy’s run will be that much more explosive. Keep holding  is coming,2024-10-17
"Hiiiii!

VROOM VROOM!

(ad/gifted) The kind folks @PTonicFriends /@PlaytonicGames  have given us a code for @VHRgame by @skydevilpalm  to play on tonights stream!  THANK YOU!

It might be Cold Weather but the VICTORY is about HEAT up (Rally). :D

http://twitch.tv/faz_d",2024-10-17
"""Not able to run for two weeks"": Trump cancels NRA rally appearance amid decline concerns. Something is terribly wrong with Trump and they’re hiding it from us.
#TrumpIsNotWell",2024-10-17
Will it all come together? Trumps wins next month? Bitcoin starts to rally? I go on my vacation?,2024-10-17
"If you know about today's Trump rally, but not about the three big rulings from the Pennsylvania Supreme Court, you missed some of the biggest political news of the day.

That's why Democracy Docket's 16-person team sends free daily and weekly newsletters: http://democracydocket.com/me-subscribe",2024-10-05
"The Street - le news da Wall Street con @sspatti
Altro record per il Dow, il 39esimo del 2024
TSMC riaccende il rally AI: altro record per Nvidia 
Uber in calo, Expedia in rialzo con ipotesi nozze
Netflix: i risultati superano le aspettative 
Medio Oriente: Usa",2024-10-17
Here’s the signup link for Trump’s rally at Madison Square Garden!   Enjoy!,2024-10-14
Thank you @NicolleDWallace for saying you’ll show us Kamala Harris rally & with Mark Cuban! #DeadlineWh,2024-10-17
"HAPPENING NOW: Kamala Harris 
disrespected a Latino voter who confronted her with criticism for her hurricane response at her Pittsburg Pennsylvania rally:

Kamala Harris: ""This is not a time for people to play politics.""",2024-10-11
"Is SUI's recent bullish behavior signaling a 20% rally?

Dive into the analysis here: https://ambcrypto.com/sui-is-recent-bull-behavior-pointing-to-a-20-rally/…
#SUI #Crypto",2024-10-17
"I'm am overwhelmed by all the suppprt & feedback from my post. You all are great American Patriots Any follows I got, I promise I will get you all back . My vote is just 1 though, rally together and let's make Trump our president again. ",2024-10-17
"I didn't think I'd ever be able to get to a Trump rally but luck was with me today and I was able to get a spot in the upcoming town hall in Lancaster, PA. 
I'm just a little excited.",2024-10-17
"Still looking for lower on CRV/BTC before the big rally, but think we may see some relief here the next few days if $BTC can chop at these highs just a bit longer. 

Looks small but thats a 20% move right there. 

CRV also back to my last entry just above the .24 lows. 

Longed",2024-10-17
Rally with VP Kamala Harris and Mark Cuban in Wisconsin | Harris-Walz 2024 https://youtube.com/live/orMe94M87DY?si=u5QY7cSQAi7Knq-r… via @YouTube. #BlueWaveRising #KamalaCaresForUS,2024-10-17
"Tried putting up the green screen one more time.

As most people hear in their life.....

""It just wasn't long enough.""",2024-10-17
THE Greatest Homecoming on Earth  Pep Rally Vibes!  #AggiePride,2024-10-17
"Listen to the latest Urban Waters Speak episode from the #UrbanWaters Learning Network, featuring 4 panelists sharing stories of resilience. 

This conversation was recorded at River Rally in May as part of the Urban Waters Learning Forum. https://ow.ly/XOVn50TN3Aj
#WaterStories",2024-10-17
Can’t wait for the day Imran khan leading a rally from Adiala to Zaman Park. ,2024-10-17
"President Trump is having a rally tomorrow in Detroit Michigan...   

Ticket info ",2024-10-17
"Disagree with #2. They’re going to assassinate him. Invoking the 25th will be too much trouble & they know as long as he’s alive, he’ll never shut his mouth, rally his base. Winning this election will literally be a death sentence for him. All these “attempts” aren’t coincidence",2024-10-17
Man arrested with guns near California Trump rally sues sheriff for defamation,2024-10-17
You can watch the Kamala Harris rally in Wisconsin in 30 minutes on her YouTube channel. Mark Cuban will be joining her. Start time estimate 2:20 MST,2024-10-17
NRA cancels Trump rally in Savannah,2024-10-17
"Al termine della prima giornata del #CER2024, penultimo atto del #WRC , è subito lotta tra Ogier e Neuville.
https://t.ly/GgLyb",2024-10-17
"The last rally President Trump had at the Minden-Tahoe Airport drew an estimated crowd of 15-20k people. 

We do know that about 3k head of cattle have been mooooved to make room for parking.",2024-10-17
"We had so much fun this afternoon bringing our cheerleaders, football players and Spartan Marching Pride to Springview Manor for a pep rally!  #family #spartansgiveback",2024-10-17
"Oops 

Thierry Neuville damaged the front of his Hyundai on the very first stage of Central European Rally 

It can't be fixed until Friday afternoon due to the rally's service itinerary  #WRC",2024-10-17
"AÇORES 
Campeonato dos Açores de Ralis
PicoWines Rali
Itinerário
Inscritos

#rallyface2013 #rallyface #rallye #rallyfans #Rally2 #rallycar #rallyracing #motorsport #rallying #rallylife #RallyforLife #rali #portugal #Azores #azoresislands #fpak #pico",2024-10-17
"New Crypto to Buy Now for 100x Gains: Life-Changing Investments Set to EXPLODE in the Next Market Rally (High Returns by January 2025) https://ift.tt/9sqcJuN October 17, 2024 at 01:16PM #crypto #cryptonews #bitcoin",2024-10-17
"Good range to bid on a $SPEED dip right now. Finding a new floor after a strong rally. Check it out boss, I know you've been watching.

The jeets and flippers are scared of the next green candle

NYOOOOM ",2024-10-17
"Join UAW members, Region 1A Director Laura Dickerson, and @ShawnFainUAW next Wednesday, October 23, at UAW Local 372 as we rally and march to the Stellantis’ Trenton Engine Plant to demand the company keep its promise to its workers and to America.",2024-10-17
"""This is not normal behavior. This is not a competent, normal person. This is crazy, but there he is. ""

— @Eugene_Robinson reacts to Trump's ""bizarre"" PA rally on Monday night, where he stood onstage swaying to songs like ""YMCA"" and ""November Rain"" for nearly 40 minutes",2024-10-15
"Wow! Trump used Libs of TikTok’s woke military compilation at his rally!!!

Make our military great again! ",2024-10-09
"Signed up for seats at the NY Maga rally I have no plan to attend so he gets empty seats, and I keep getting strange messages like this. ",2024-10-17
"I guess we will see how many Nazi’s are in New York.

‘He’s obsessed’: Why Donald Trump is willing to pay a fortune to host a rally at MSG

Source: The Independent",2024-10-17
"Lauren Boebert is at Donald Trump's hate rally in Aurora, Colorado.

What's up with her facial expressions?

Super cringe.",2024-10-11
