Tweet,Date
"#KENYA: A Ugandan Olympian is in intensive care in a Kenyan hospital after being doused with petrol and set on fire allegedly by her partner, officials said Tuesday, the latest horrific incident of gender-based violence in the East African country.
 Long-distance runner Rebecca",2024-09-03
Voir ce film c’est revoir un traumatisme à distance comme on le fait en hypnose et comprendre quelle violence et quel stress on a pu  subir à 18 ans,2024-09-19
"“Israel’s military…attacked its enemies in two countries & Gaza…with a long-distance airstrike in Yemen amid escalating violence between #Israel & Iranian-backed proxies across the #MiddleEast, inching the combatants closer to an all-out regional war.”",2024-09-30
"As a Sydney Uni student, I’m horrified to see my university attempt to equate “Arabic text” with violence.

This is an explicitly racist statement from the uni, and it’s indefensible.

I’m a distance student so I won’t be there, but I’m in solidarity with the protestors.",2024-09-24
"This statement is so far beyond Palestinian solidarity - I agree the pro-Palestinian protestors should be allowed to protest, but I think those in that movement who think advocating for the collapse of the university and violence in America have a responsibility to distance",2024-09-04
"Please provide first aid immediately. 

The use of power will increase the anger and maintain the distance.
Stop violence on peaceful protestors.
#IKJalsa28September
#خان_کی_پُکار_پر_لبیک",2024-09-28
"Golfers.

Your training meeds more violence to it.

What does this mean?

You need to be moving the med ball, barbell, dumbell, kettlebell with high intent each rep",2024-10-01
"A harrowing reminder of how technology can alienate us from the impact of violence and a sign of how war is dehumanized, anonymized, and waged with increasing distance.",2024-09-17
the person in the bg saying “let’s keep some physical distance please” like brittany saying “stop the violence”,2024-10-17
"Salman Sb, 

My deep respect for you aside, my main issue with PTI is this: should its tier one leadership (which now includes you), categorically disown and distance from hate and violence mongering actors (whether online or on the streets)? Should PTI not learn to do politics",2024-10-17
"Israel and the U.S. are grinding Gaza into a fine, bloody paste. Yet according to Democrat Zionists like this scum, it’s Palestinians who need to distance themselves from violence. This is how you normalize the demonization and destruction of a people. Sick stuff",2024-09-11
"Nah babygirl this long distance was trial and error. This ain’t for you and it’s ok, but don’t act like this heartbreak hotel, you are capable of finding someone who has time for you. No begs. You got it girlie",2024-03-21
"2/
They'll claim that any disagreement, refutation, or push-back regarding Radical Gender Theory is the cause of violence and murder. 

They hope to erode the distinction between inciting violence on one hand, and intellectual disagreement on the other so they can silence dissent",2022-12-29
"TW abuse, violence, DA

This is terrifying. Strangulation is the number one predictor for future intimate partner violence (IPV) and increases the risk of death exponentially. It's also not taken as seriously as other forms of IPV due to less obvious injuries.",2023-11-19
"Long distance attacks (whether airstrikes or missiles) are not a sign of a government willing to negotiate a ceasefire. In the context of #Tigray it's all the more cruel. People can't run, they can't hide. They are the target in this genocidal war.",2021-11-20
"E zamisli sta se dogodilo sinoc, ljudi su nenormalni, sad ću da ti pokažem.  Vadi telefon i pokazuje mi snimak kako neki dečko čupa i šamara neku devojku, onako krvnički, na parkingu. A ta moja simpatija SEDI U AUTU NA PAR METARA OD TOG JEZIVOG DEŠAVANJA I SNIMA. ",2024-06-05
"This is the only reason I distance myself from my childhood friend physically back then. Though we talk time to time.
3months after I did that I made my 1st 1M.
Because I hate when pple don't see far.",2024-10-12
"in jeonju, a man in his 50s beat a teen girl with his fists and a blunt object after mistaking what she said on a phone call to be about him. she was bleeding on the ground, being strangled, by the time a passing jogger witnessed the assault and helped her.",2023-11-11
"At least you should have kept distance from violence on Gandhi Jayanti, haramkhors.",2024-10-01
"Ça fait sens. La déshumanisation de l'autre ne fait pas que créer des discriminations, elle permet aussi à notre conscience de créer une distance entre humanité et violence.
Non, ces comportements sont bel et bien humains, c'est le problème.

Tous les monstres sont humains.",2024-09-02
"Women who have escaped violent men and boys say many of the episodes of violence begin over video games. Boys battering their mothers when refused video game purchases, men battering their wives when told to put down the game and help with the children. I would ban them, frankly. https://t.co/diQJsUbw0n",2022-12-01
"Urban: 10-20yds
Suburban: 50-75yds
Rural: 100-300yds
Obviously, this is seasonally and situationally dependent but there would be an initial requirement of positive identification that would affect these engagement distances  early on during a civil conflict.",2024-09-06
Why do I call it “violence”?  Its effects would be (and have been) measured in terms of real deaths and injuries.  The attacks on Covid pandemic-curbing measures is one example; the spread of other disinformation that kills is another.,2022-05-17
"Political violence is always wrong, we have democracy for a reason. But in this case it is also a strategic mistake, and I want everyone out there who thinks violence is the answer to see that violence is both morally wrong AND also a strategic mistake.",2022-08-19
"One of my close friends living in the UK was stabbed to d3ath by her supposed ex because he didn't  ""approve"" of her distancing herself from him. And catch this, they weren't officially dating. They had been on less than 5 dates together when she told him it wasn't working.",2023-05-10
"the ""Literal Violence"" cracks when this person very literally saying how she makes sure an improvised weapon is within reach in case there's a chance to do some bashing is really something.

You just said in as many words that you're arming yourself to assault someone ma'am.",2023-09-29
There is no such thing as a online violence.  It is a manufactured concept to justify tyranny and oppressing by governments.,2024-08-10
"A woman was killed by her male friend for beating him at basketball. They weren't strangers to each other. Ladies, be careful out there. It might just be a simple game to you, not knowing that's what the other person hinges their current entire existence on.",2024-04-06
"No. Violence is physical.  

Catcalling isn't violence. Stalking isn't violence.  Checking her phone isn't violence.  Online harassment (""mean tweets!"") isn't violence. Forbidding her to go to work or see friends isn't violence. 

These are/can be abusive, but not ""violence.""",2023-11-30
"Research on DV shows a) that when a partner is leaving, or has already left,mis the most dangerous time in terms of domestic homicides b) Strangulation is often axprelude to domestic murder.",2023-02-25
"Harassment and stalking are warning signs of escalating violence “and when not taken seriously they can lead to fatalities, like femicide,” said expert @farrahsafiakhan. 

“It’s devastating to learn that a woman was failed by systems that are meant to protect her.”",2023-03-29
"Leaving and the 2 years after leaving are the most dangerous times for someone who is experiencing domestic violence. And most laws to protect victims are either weakly enforced or escalate the situation. 

More than half of all intimate partner homicides are committed with guns",2022-07-09
"Reality in US urban environments right now -- do not walk within arms length of any stranger.  

Do not give them the physical ability to do harm to you in an unprovoked manner like this.",2024-03-28
"Remote targeted killings... 2750 injured, 200 of them critical. 

Intentionally directing attacks against individual civilians not taking direct part in hostilities
+
in the knowledge they will cause clearly excessive incidental civilian harm",2024-09-17
"That's commendable but by saying it here in this tone you're invalidating other person's trauma. What you need is a lesson in empathy. That said, DV also includes emotional, mental & verbal violence and not just physical.",2024-08-19
I saw a video of a girl with a knife warning another girl to stay away from her man. The victim was already st@bbed in the hand and was bIeeding. You people hurt others because of relationships?,2023-02-04
"Violent crime by strangers fell during lockdown years, basically because people couldn't get at each other and nighttime economy was shut. It's been making up for lost time since. As ever football just tells you what's going on, it doesn't create this stuff",2022-05-20
"Images of a woman who was walking on the road in South America when a man she did not know ran after her, first pulled her hair and then kicked her, went viral on social media. The incident took place in a very crowded street, and for a while the people around could not",2024-01-02
"“Sometimes victims respond with violence, or even encourage the violence so they can get it over with, knowing that it’s going to happen. It’s so complex, and that term, ‘mutual abuse,’ is very harmful.” -- @ruthmglenn of @NCADV",2022-05-28
"He isn't physical just emotionally cruel. He just yells. He just slams things & punches walls. He only grabs my arm. He only punched me in the back, not the face. Yes, he hits me but he doesn't hit the kids. A good father & provider

Women are taught to give him a chance to death",2023-02-15
"The issue is clear in the last derb, violence came from a specific route and a group of fans even though no one was arrested.

FCK Fans has and will distance themselves from  violence or any criminal activities, football for all.

#fcklive",2024-09-14
"Allez, ça chouine. Pourtant la violence des 2 situations est mise à distance (du coup regardable, ce qui n'est pas gagné avec l'horreur de l'une d'elles) et dénoncée. Et le dessin s'inscrit dans la tradition d'un regard parfois cruel sur les drames de l'actu (""bal tragique à C"").",2024-09-05
"Violence  for men ,distance  for women",2024-09-29
On sous estime souvent la distance du mur et sous estime la violence des ajustements ahah.,2024-09-04
"At least 17 more people have made accusations of sexual violence against a French monk who became a household name for his charity work, according to a report published Friday, prompting his charities to distance themselves from their founder.
https://u.afp.com/5bWn",2024-09-06
The evidence against Danny Tommo to prove incitement to violence is very clear but no arrest. The man has a record of making threats from a safe distance and bent coppers allow him to get away with it. His dumbass fanboys did the same in November 2017....,2024-10-04
"Trucks don’t follow any rules..

Violence is bad, but bumping from behind… not keeping safe distance etc are never followed by these truck walas. In traffic, heavily loaded trucks stop just few feet behind cars and passenger vehicles. Scary people…",2024-09-13
"Ok, il y a le début des Paralympiques. Mais rien n’empechait de s’expliquer sur sa Une d’hier.
Mais non. Rien. 
Il leur est dc normal de n’avoie aucune distance au sujet d’un joueur à qui colle aux basques une histoire récente de violence conjuguale.
La honte sans condition",2024-08-28
"La violence dont il fait preuve..

La distance qu’elle met entre eux dès le départ…",2024-09-13
"""It is not the violence that sets men apart, alright, it is the distance that he is prepared to go"" Forrest Bondurant",2024-09-13
"Russia is clear in their submissions at the UNSC emergency meeting now.

Israel must distance itself from the illusion of thinking violence will bring peace.",2024-10-02
"Bad decision because when it comes to violence & R rated content, Disney is not willing to take it there & for some of the Marvel content, you gotta go the distance. That’s why the Venom movies was mid.",2024-08-31
Just know that every single Kamala voter is enabling this type of violence. Some of you personally know people that will be voting Kamala. That person is lying to you and themselves when they say this isn’t happening. You’d be wise to distance yourself from those people.,2024-10-10
